échantillon,Plage,region,substrat,date,length,slug,code,quantité,pcs/m
"('amphion', '01.02.2022')",Amphion,Grand lac,4,2022-02-01,91,amphion,G159,0,0.0
"('amphion', '01.02.2022')",Amphion,Grand lac,4,2022-02-01,91,amphion,G10,0,0.0
"('amphion', '01.02.2022')",Amphion,Grand lac,4,2022-02-01,91,amphion,G103,0,0.0
"('amphion', '01.02.2022')",Amphion,Grand lac,4,2022-02-01,91,amphion,G106,0,0.0
"('amphion', '01.02.2022')",Amphion,Grand lac,4,2022-02-01,91,amphion,G117,0,0.0
"('amphion', '01.02.2022')",Amphion,Grand lac,4,2022-02-01,91,amphion,G2,0,0.0
"('amphion', '01.02.2022')",Amphion,Grand lac,4,2022-02-01,91,amphion,G25,0,0.0
"('amphion', '01.02.2022')",Amphion,Grand lac,4,2022-02-01,91,amphion,G74,0,0.0
"('amphion', '01.02.2022')",Amphion,Grand lac,4,2022-02-01,91,amphion,G89,0,0.0
"('amphion', '01.02.2022')",Amphion,Grand lac,4,2022-02-01,91,amphion,G112,0,0.0
"('amphion', '01.02.2022')",Amphion,Grand lac,4,2022-02-01,91,amphion,G125,0,0.0
"('amphion', '01.02.2022')",Amphion,Grand lac,4,2022-02-01,91,amphion,G135,0,0.0
"('amphion', '01.02.2022')",Amphion,Grand lac,4,2022-02-01,91,amphion,G145,0,0.0
"('amphion', '01.02.2022')",Amphion,Grand lac,4,2022-02-01,91,amphion,G29,0,0.0
"('amphion', '01.02.2022')",Amphion,Grand lac,4,2022-02-01,91,amphion,G32,0,0.0
"('amphion', '01.02.2022')",Amphion,Grand lac,4,2022-02-01,91,amphion,G50,0,0.0
"('amphion', '01.02.2022')",Amphion,Grand lac,4,2022-02-01,91,amphion,G99,0,0.0
"('amphion', '01.02.2022')",Amphion,Grand lac,4,2022-02-01,91,amphion,G132,0,0.0
"('amphion', '01.02.2022')",Amphion,Grand lac,4,2022-02-01,91,amphion,G53,0,0.0
"('amphion', '01.02.2022')",Amphion,Grand lac,4,2022-02-01,91,amphion,G165,0,0.0
"('amphion', '01.02.2022')",Amphion,Grand lac,4,2022-02-01,91,amphion,G137,0,0.0
"('amphion', '01.02.2022')",Amphion,Grand lac,4,2022-02-01,91,amphion,G73,0,0.0
"('amphion', '01.02.2022')",Amphion,Grand lac,4,2022-02-01,91,amphion,G926,0,0.0
"('amphion', '01.02.2022')",Amphion,Grand lac,4,2022-02-01,91,amphion,G126,0,0.0
"('amphion', '01.02.2022')",Amphion,Grand lac,4,2022-02-01,91,amphion,G128,0,0.0
"('amphion', '01.02.2022')",Amphion,Grand lac,4,2022-02-01,91,amphion,G194,0,0.0
"('amphion', '01.02.2022')",Amphion,Grand lac,4,2022-02-01,91,amphion,G26,0,0.0
"('amphion', '01.02.2022')",Amphion,Grand lac,4,2022-02-01,91,amphion,G48,0,0.0
"('amphion', '01.02.2022')",Amphion,Grand lac,4,2022-02-01,91,amphion,G901,0,0.0
"('amphion', '01.02.2022')",Amphion,Grand lac,4,2022-02-01,91,amphion,G929,0,0.0
"('amphion', '01.02.2022')",Amphion,Grand lac,4,2022-02-01,91,amphion,G101,0,0.0
"('amphion', '01.02.2022')",Amphion,Grand lac,4,2022-02-01,91,amphion,G34,0,0.0
"('amphion', '01.02.2022')",Amphion,Grand lac,4,2022-02-01,91,amphion,G100,0,0.0
"('amphion', '01.02.2022')",Amphion,Grand lac,4,2022-02-01,91,amphion,G12,0,0.0
"('amphion', '01.02.2022')",Amphion,Grand lac,4,2022-02-01,91,amphion,G144,0,0.0
"('amphion', '01.02.2022')",Amphion,Grand lac,4,2022-02-01,91,amphion,G18,0,0.0
"('amphion', '01.02.2022')",Amphion,Grand lac,4,2022-02-01,91,amphion,G33,0,0.0
"('amphion', '01.02.2022')",Amphion,Grand lac,4,2022-02-01,91,amphion,G67,0,0.0
"('amphion', '01.02.2022')",Amphion,Grand lac,4,2022-02-01,91,amphion,G90,0,0.0
"('amphion', '01.02.2022')",Amphion,Grand lac,4,2022-02-01,91,amphion,G937,0,0.0
"('amphion', '01.02.2022')",Amphion,Grand lac,4,2022-02-01,91,amphion,G133,0,0.0
"('amphion', '01.02.2022')",Amphion,Grand lac,4,2022-02-01,91,amphion,G28,0,0.0
"('amphion', '01.02.2022')",Amphion,Grand lac,4,2022-02-01,91,amphion,G39,0,0.0
"('amphion', '01.02.2022')",Amphion,Grand lac,4,2022-02-01,91,amphion,G4,0,0.0
"('amphion', '01.02.2022')",Amphion,Grand lac,4,2022-02-01,91,amphion,G54,0,0.0
"('amphion', '01.02.2022')",Amphion,Grand lac,4,2022-02-01,91,amphion,G7,0,0.0
"('amphion', '01.02.2022')",Amphion,Grand lac,4,2022-02-01,91,amphion,G155,0,0.0
"('amphion', '01.02.2022')",Amphion,Grand lac,4,2022-02-01,91,amphion,G127,0,0.0
"('amphion', '01.02.2022')",Amphion,Grand lac,4,2022-02-01,91,amphion,G129,0,0.0
"('amphion', '01.02.2022')",Amphion,Grand lac,4,2022-02-01,91,amphion,G136,0,0.0
"('amphion', '01.02.2022')",Amphion,Grand lac,4,2022-02-01,91,amphion,G80,0,0.0
"('amphion', '01.02.2022')",Amphion,Grand lac,4,2022-02-01,91,amphion,G102,0,0.0
"('amphion', '01.02.2022')",Amphion,Grand lac,4,2022-02-01,91,amphion,G139,0,0.0
"('amphion', '03.05.2022')",Amphion,Grand lac,4,2022-05-03,91,amphion,G113,0,0.0
"('amphion', '03.05.2022')",Amphion,Grand lac,4,2022-05-03,91,amphion,G114,0,0.0
"('amphion', '03.05.2022')",Amphion,Grand lac,4,2022-05-03,91,amphion,G148,0,0.0
"('amphion', '03.05.2022')",Amphion,Grand lac,4,2022-05-03,91,amphion,G23,0,0.0
"('amphion', '03.05.2022')",Amphion,Grand lac,4,2022-05-03,91,amphion,G66,0,0.0
"('amphion', '03.05.2022')",Amphion,Grand lac,4,2022-05-03,91,amphion,G914,0,0.0
"('amphion', '03.05.2022')",Amphion,Grand lac,4,2022-05-03,91,amphion,G931,0,0.0
"('amphion', '03.05.2022')",Amphion,Grand lac,4,2022-05-03,91,amphion,G97,0,0.0
"('amphion', '03.05.2022')",Amphion,Grand lac,4,2022-05-03,91,amphion,G10,0,0.0
"('amphion', '03.05.2022')",Amphion,Grand lac,4,2022-05-03,91,amphion,G103,0,0.0
"('amphion', '03.05.2022')",Amphion,Grand lac,4,2022-05-03,91,amphion,G106,0,0.0
"('amphion', '03.05.2022')",Amphion,Grand lac,4,2022-05-03,91,amphion,G117,0,0.0
"('amphion', '03.05.2022')",Amphion,Grand lac,4,2022-05-03,91,amphion,G2,0,0.0
"('amphion', '03.05.2022')",Amphion,Grand lac,4,2022-05-03,91,amphion,G25,0,0.0
"('amphion', '03.05.2022')",Amphion,Grand lac,4,2022-05-03,91,amphion,G74,0,0.0
"('amphion', '03.05.2022')",Amphion,Grand lac,4,2022-05-03,91,amphion,G89,0,0.0
"('amphion', '03.05.2022')",Amphion,Grand lac,4,2022-05-03,91,amphion,G112,0,0.0
"('amphion', '03.05.2022')",Amphion,Grand lac,4,2022-05-03,91,amphion,G125,0,0.0
"('amphion', '03.05.2022')",Amphion,Grand lac,4,2022-05-03,91,amphion,G135,0,0.0
"('amphion', '03.05.2022')",Amphion,Grand lac,4,2022-05-03,91,amphion,G145,0,0.0
"('amphion', '03.05.2022')",Amphion,Grand lac,4,2022-05-03,91,amphion,G29,0,0.0
"('amphion', '03.05.2022')",Amphion,Grand lac,4,2022-05-03,91,amphion,G32,0,0.0
"('amphion', '03.05.2022')",Amphion,Grand lac,4,2022-05-03,91,amphion,G50,0,0.0
"('amphion', '03.05.2022')",Amphion,Grand lac,4,2022-05-03,91,amphion,G99,0,0.0
"('amphion', '03.05.2022')",Amphion,Grand lac,4,2022-05-03,91,amphion,G132,0,0.0
"('amphion', '03.05.2022')",Amphion,Grand lac,4,2022-05-03,91,amphion,G53,0,0.0
"('amphion', '03.05.2022')",Amphion,Grand lac,4,2022-05-03,91,amphion,G165,0,0.0
"('amphion', '03.05.2022')",Amphion,Grand lac,4,2022-05-03,91,amphion,G137,0,0.0
"('amphion', '03.05.2022')",Amphion,Grand lac,4,2022-05-03,91,amphion,G73,0,0.0
"('amphion', '03.05.2022')",Amphion,Grand lac,4,2022-05-03,91,amphion,G926,0,0.0
"('amphion', '03.05.2022')",Amphion,Grand lac,4,2022-05-03,91,amphion,G126,0,0.0
"('amphion', '03.05.2022')",Amphion,Grand lac,4,2022-05-03,91,amphion,G128,0,0.0
"('amphion', '03.05.2022')",Amphion,Grand lac,4,2022-05-03,91,amphion,G194,0,0.0
"('amphion', '03.05.2022')",Amphion,Grand lac,4,2022-05-03,91,amphion,G26,0,0.0
"('amphion', '03.05.2022')",Amphion,Grand lac,4,2022-05-03,91,amphion,G48,0,0.0
"('amphion', '03.05.2022')",Amphion,Grand lac,4,2022-05-03,91,amphion,G901,0,0.0
"('amphion', '03.05.2022')",Amphion,Grand lac,4,2022-05-03,91,amphion,G929,0,0.0
"('amphion', '03.05.2022')",Amphion,Grand lac,4,2022-05-03,91,amphion,G101,0,0.0
"('amphion', '03.05.2022')",Amphion,Grand lac,4,2022-05-03,91,amphion,G34,0,0.0
"('amphion', '03.05.2022')",Amphion,Grand lac,4,2022-05-03,91,amphion,G100,0,0.0
"('amphion', '03.05.2022')",Amphion,Grand lac,4,2022-05-03,91,amphion,G12,0,0.0
"('amphion', '03.05.2022')",Amphion,Grand lac,4,2022-05-03,91,amphion,G144,0,0.0
"('amphion', '03.05.2022')",Amphion,Grand lac,4,2022-05-03,91,amphion,G18,0,0.0
"('amphion', '03.05.2022')",Amphion,Grand lac,4,2022-05-03,91,amphion,G33,0,0.0
"('amphion', '03.05.2022')",Amphion,Grand lac,4,2022-05-03,91,amphion,G67,0,0.0
"('amphion', '03.05.2022')",Amphion,Grand lac,4,2022-05-03,91,amphion,G90,0,0.0
"('amphion', '03.05.2022')",Amphion,Grand lac,4,2022-05-03,91,amphion,G937,0,0.0
"('amphion', '03.05.2022')",Amphion,Grand lac,4,2022-05-03,91,amphion,G133,0,0.0
"('amphion', '03.05.2022')",Amphion,Grand lac,4,2022-05-03,91,amphion,G28,0,0.0
"('amphion', '03.05.2022')",Amphion,Grand lac,4,2022-05-03,91,amphion,G39,0,0.0
"('amphion', '03.05.2022')",Amphion,Grand lac,4,2022-05-03,91,amphion,G4,0,0.0
"('amphion', '03.05.2022')",Amphion,Grand lac,4,2022-05-03,91,amphion,G54,0,0.0
"('amphion', '03.05.2022')",Amphion,Grand lac,4,2022-05-03,91,amphion,G7,0,0.0
"('amphion', '03.05.2022')",Amphion,Grand lac,4,2022-05-03,91,amphion,G155,0,0.0
"('amphion', '03.05.2022')",Amphion,Grand lac,4,2022-05-03,91,amphion,G127,0,0.0
"('amphion', '03.05.2022')",Amphion,Grand lac,4,2022-05-03,91,amphion,G129,0,0.0
"('amphion', '03.05.2022')",Amphion,Grand lac,4,2022-05-03,91,amphion,G136,0,0.0
"('amphion', '03.05.2022')",Amphion,Grand lac,4,2022-05-03,91,amphion,G80,0,0.0
"('amphion', '03.05.2022')",Amphion,Grand lac,4,2022-05-03,91,amphion,G102,0,0.0
"('amphion', '03.05.2022')",Amphion,Grand lac,4,2022-05-03,91,amphion,G139,0,0.0
"('amphion', '18.10.2022')",Amphion,Grand lac,4,2022-10-18,91,amphion,G131,0,0.0
"('amphion', '18.10.2022')",Amphion,Grand lac,4,2022-10-18,91,amphion,G148,0,0.0
"('amphion', '18.10.2022')",Amphion,Grand lac,4,2022-10-18,91,amphion,G914,0,0.0
"('amphion', '18.10.2022')",Amphion,Grand lac,4,2022-10-18,91,amphion,G931,0,0.0
"('amphion', '18.10.2022')",Amphion,Grand lac,4,2022-10-18,91,amphion,G97,0,0.0
"('amphion', '18.10.2022')",Amphion,Grand lac,4,2022-10-18,91,amphion,G159,0,0.0
"('amphion', '18.10.2022')",Amphion,Grand lac,4,2022-10-18,91,amphion,G112,0,0.0
"('amphion', '18.10.2022')",Amphion,Grand lac,4,2022-10-18,91,amphion,G125,0,0.0
"('amphion', '18.10.2022')",Amphion,Grand lac,4,2022-10-18,91,amphion,G135,0,0.0
"('amphion', '18.10.2022')",Amphion,Grand lac,4,2022-10-18,91,amphion,G145,0,0.0
"('amphion', '18.10.2022')",Amphion,Grand lac,4,2022-10-18,91,amphion,G29,0,0.0
"('amphion', '18.10.2022')",Amphion,Grand lac,4,2022-10-18,91,amphion,G32,0,0.0
"('amphion', '18.10.2022')",Amphion,Grand lac,4,2022-10-18,91,amphion,G50,0,0.0
"('amphion', '18.10.2022')",Amphion,Grand lac,4,2022-10-18,91,amphion,G99,0,0.0
"('amphion', '18.10.2022')",Amphion,Grand lac,4,2022-10-18,91,amphion,G132,0,0.0
"('amphion', '18.10.2022')",Amphion,Grand lac,4,2022-10-18,91,amphion,G53,0,0.0
"('amphion', '18.10.2022')",Amphion,Grand lac,4,2022-10-18,91,amphion,G165,0,0.0
"('amphion', '18.10.2022')",Amphion,Grand lac,4,2022-10-18,91,amphion,G137,0,0.0
"('amphion', '18.10.2022')",Amphion,Grand lac,4,2022-10-18,91,amphion,G73,0,0.0
"('amphion', '18.10.2022')",Amphion,Grand lac,4,2022-10-18,91,amphion,G926,0,0.0
"('amphion', '18.10.2022')",Amphion,Grand lac,4,2022-10-18,91,amphion,G126,0,0.0
"('amphion', '18.10.2022')",Amphion,Grand lac,4,2022-10-18,91,amphion,G128,0,0.0
"('amphion', '18.10.2022')",Amphion,Grand lac,4,2022-10-18,91,amphion,G194,0,0.0
"('amphion', '18.10.2022')",Amphion,Grand lac,4,2022-10-18,91,amphion,G26,0,0.0
"('amphion', '18.10.2022')",Amphion,Grand lac,4,2022-10-18,91,amphion,G48,0,0.0
"('amphion', '18.10.2022')",Amphion,Grand lac,4,2022-10-18,91,amphion,G901,0,0.0
"('amphion', '18.10.2022')",Amphion,Grand lac,4,2022-10-18,91,amphion,G929,0,0.0
"('amphion', '18.10.2022')",Amphion,Grand lac,4,2022-10-18,91,amphion,G101,0,0.0
"('amphion', '18.10.2022')",Amphion,Grand lac,4,2022-10-18,91,amphion,G34,0,0.0
"('amphion', '18.10.2022')",Amphion,Grand lac,4,2022-10-18,91,amphion,G100,0,0.0
"('amphion', '18.10.2022')",Amphion,Grand lac,4,2022-10-18,91,amphion,G12,0,0.0
"('amphion', '18.10.2022')",Amphion,Grand lac,4,2022-10-18,91,amphion,G144,0,0.0
"('amphion', '18.10.2022')",Amphion,Grand lac,4,2022-10-18,91,amphion,G18,0,0.0
"('amphion', '18.10.2022')",Amphion,Grand lac,4,2022-10-18,91,amphion,G33,0,0.0
"('amphion', '18.10.2022')",Amphion,Grand lac,4,2022-10-18,91,amphion,G67,0,0.0
"('amphion', '18.10.2022')",Amphion,Grand lac,4,2022-10-18,91,amphion,G90,0,0.0
"('amphion', '18.10.2022')",Amphion,Grand lac,4,2022-10-18,91,amphion,G937,0,0.0
"('amphion', '18.10.2022')",Amphion,Grand lac,4,2022-10-18,91,amphion,G133,0,0.0
"('amphion', '18.10.2022')",Amphion,Grand lac,4,2022-10-18,91,amphion,G28,0,0.0
"('amphion', '18.10.2022')",Amphion,Grand lac,4,2022-10-18,91,amphion,G39,0,0.0
"('amphion', '18.10.2022')",Amphion,Grand lac,4,2022-10-18,91,amphion,G4,0,0.0
"('amphion', '18.10.2022')",Amphion,Grand lac,4,2022-10-18,91,amphion,G54,0,0.0
"('amphion', '18.10.2022')",Amphion,Grand lac,4,2022-10-18,91,amphion,G7,0,0.0
"('amphion', '18.10.2022')",Amphion,Grand lac,4,2022-10-18,91,amphion,G155,0,0.0
"('amphion', '18.10.2022')",Amphion,Grand lac,4,2022-10-18,91,amphion,G127,0,0.0
"('amphion', '18.10.2022')",Amphion,Grand lac,4,2022-10-18,91,amphion,G129,0,0.0
"('amphion', '18.10.2022')",Amphion,Grand lac,4,2022-10-18,91,amphion,G136,0,0.0
"('amphion', '18.10.2022')",Amphion,Grand lac,4,2022-10-18,91,amphion,G80,0,0.0
"('amphion', '18.10.2022')",Amphion,Grand lac,4,2022-10-18,91,amphion,G102,0,0.0
"('amphion', '18.10.2022')",Amphion,Grand lac,4,2022-10-18,91,amphion,G139,0,0.0
"('amphion', '19.07.2022')",Amphion,Grand lac,4,2022-07-19,91,amphion,G113,0,0.0
"('amphion', '19.07.2022')",Amphion,Grand lac,4,2022-07-19,91,amphion,G131,0,0.0
"('amphion', '19.07.2022')",Amphion,Grand lac,4,2022-07-19,91,amphion,G148,0,0.0
"('amphion', '19.07.2022')",Amphion,Grand lac,4,2022-07-19,91,amphion,G23,0,0.0
"('amphion', '19.07.2022')",Amphion,Grand lac,4,2022-07-19,91,amphion,G914,0,0.0
"('amphion', '19.07.2022')",Amphion,Grand lac,4,2022-07-19,91,amphion,G931,0,0.0
"('amphion', '19.07.2022')",Amphion,Grand lac,4,2022-07-19,91,amphion,G97,0,0.0
"('amphion', '19.07.2022')",Amphion,Grand lac,4,2022-07-19,91,amphion,G159,0,0.0
"('amphion', '19.07.2022')",Amphion,Grand lac,4,2022-07-19,91,amphion,G10,0,0.0
"('amphion', '19.07.2022')",Amphion,Grand lac,4,2022-07-19,91,amphion,G103,0,0.0
"('amphion', '19.07.2022')",Amphion,Grand lac,4,2022-07-19,91,amphion,G106,0,0.0
"('amphion', '19.07.2022')",Amphion,Grand lac,4,2022-07-19,91,amphion,G117,0,0.0
"('amphion', '19.07.2022')",Amphion,Grand lac,4,2022-07-19,91,amphion,G25,0,0.0
"('amphion', '19.07.2022')",Amphion,Grand lac,4,2022-07-19,91,amphion,G89,0,0.0
"('amphion', '19.07.2022')",Amphion,Grand lac,4,2022-07-19,91,amphion,G132,0,0.0
"('amphion', '19.07.2022')",Amphion,Grand lac,4,2022-07-19,91,amphion,G53,0,0.0
"('amphion', '19.07.2022')",Amphion,Grand lac,4,2022-07-19,91,amphion,G165,0,0.0
"('amphion', '19.07.2022')",Amphion,Grand lac,4,2022-07-19,91,amphion,G137,0,0.0
"('amphion', '19.07.2022')",Amphion,Grand lac,4,2022-07-19,91,amphion,G73,0,0.0
"('amphion', '19.07.2022')",Amphion,Grand lac,4,2022-07-19,91,amphion,G926,0,0.0
"('amphion', '19.07.2022')",Amphion,Grand lac,4,2022-07-19,91,amphion,G126,0,0.0
"('amphion', '19.07.2022')",Amphion,Grand lac,4,2022-07-19,91,amphion,G128,0,0.0
"('amphion', '19.07.2022')",Amphion,Grand lac,4,2022-07-19,91,amphion,G194,0,0.0
"('amphion', '19.07.2022')",Amphion,Grand lac,4,2022-07-19,91,amphion,G26,0,0.0
"('amphion', '19.07.2022')",Amphion,Grand lac,4,2022-07-19,91,amphion,G48,0,0.0
"('amphion', '19.07.2022')",Amphion,Grand lac,4,2022-07-19,91,amphion,G901,0,0.0
"('amphion', '19.07.2022')",Amphion,Grand lac,4,2022-07-19,91,amphion,G929,0,0.0
"('amphion', '19.07.2022')",Amphion,Grand lac,4,2022-07-19,91,amphion,G101,0,0.0
"('amphion', '19.07.2022')",Amphion,Grand lac,4,2022-07-19,91,amphion,G34,0,0.0
"('amphion', '19.07.2022')",Amphion,Grand lac,4,2022-07-19,91,amphion,G100,0,0.0
"('amphion', '19.07.2022')",Amphion,Grand lac,4,2022-07-19,91,amphion,G12,0,0.0
"('amphion', '19.07.2022')",Amphion,Grand lac,4,2022-07-19,91,amphion,G144,0,0.0
"('amphion', '19.07.2022')",Amphion,Grand lac,4,2022-07-19,91,amphion,G18,0,0.0
"('amphion', '19.07.2022')",Amphion,Grand lac,4,2022-07-19,91,amphion,G33,0,0.0
"('amphion', '19.07.2022')",Amphion,Grand lac,4,2022-07-19,91,amphion,G67,0,0.0
"('amphion', '19.07.2022')",Amphion,Grand lac,4,2022-07-19,91,amphion,G90,0,0.0
"('amphion', '19.07.2022')",Amphion,Grand lac,4,2022-07-19,91,amphion,G937,0,0.0
"('amphion', '19.07.2022')",Amphion,Grand lac,4,2022-07-19,91,amphion,G133,0,0.0
"('amphion', '19.07.2022')",Amphion,Grand lac,4,2022-07-19,91,amphion,G28,0,0.0
"('amphion', '19.07.2022')",Amphion,Grand lac,4,2022-07-19,91,amphion,G39,0,0.0
"('amphion', '19.07.2022')",Amphion,Grand lac,4,2022-07-19,91,amphion,G4,0,0.0
"('amphion', '19.07.2022')",Amphion,Grand lac,4,2022-07-19,91,amphion,G54,0,0.0
"('amphion', '19.07.2022')",Amphion,Grand lac,4,2022-07-19,91,amphion,G7,0,0.0
"('amphion', '19.07.2022')",Amphion,Grand lac,4,2022-07-19,91,amphion,G155,0,0.0
"('amphion', '19.07.2022')",Amphion,Grand lac,4,2022-07-19,91,amphion,G127,0,0.0
"('amphion', '19.07.2022')",Amphion,Grand lac,4,2022-07-19,91,amphion,G129,0,0.0
"('amphion', '19.07.2022')",Amphion,Grand lac,4,2022-07-19,91,amphion,G136,0,0.0
"('amphion', '19.07.2022')",Amphion,Grand lac,4,2022-07-19,91,amphion,G80,0,0.0
"('amphion', '19.07.2022')",Amphion,Grand lac,4,2022-07-19,91,amphion,G102,0,0.0
"('amphion', '19.07.2022')",Amphion,Grand lac,4,2022-07-19,91,amphion,G139,0,0.0
"('anthy', '04.05.2022')",Anthy,Grand lac,4,2022-05-04,85,anthy,G113,0,0.0
"('anthy', '04.05.2022')",Anthy,Grand lac,4,2022-05-04,85,anthy,G114,0,0.0
"('anthy', '04.05.2022')",Anthy,Grand lac,4,2022-05-04,85,anthy,G131,0,0.0
"('anthy', '04.05.2022')",Anthy,Grand lac,4,2022-05-04,85,anthy,G148,0,0.0
"('anthy', '04.05.2022')",Anthy,Grand lac,4,2022-05-04,85,anthy,G21,0,0.0
"('anthy', '04.05.2022')",Anthy,Grand lac,4,2022-05-04,85,anthy,G211,0,0.0
"('anthy', '04.05.2022')",Anthy,Grand lac,4,2022-05-04,85,anthy,G23,0,0.0
"('anthy', '04.05.2022')",Anthy,Grand lac,4,2022-05-04,85,anthy,G24,0,0.0
"('anthy', '04.05.2022')",Anthy,Grand lac,4,2022-05-04,85,anthy,G30,0,0.0
"('anthy', '04.05.2022')",Anthy,Grand lac,4,2022-05-04,85,anthy,G35,0,0.0
"('anthy', '04.05.2022')",Anthy,Grand lac,4,2022-05-04,85,anthy,G66,0,0.0
"('anthy', '04.05.2022')",Anthy,Grand lac,4,2022-05-04,85,anthy,G70,0,0.0
"('anthy', '04.05.2022')",Anthy,Grand lac,4,2022-05-04,85,anthy,G81,0,0.0
"('anthy', '04.05.2022')",Anthy,Grand lac,4,2022-05-04,85,anthy,G82,0,0.0
"('anthy', '04.05.2022')",Anthy,Grand lac,4,2022-05-04,85,anthy,G914,0,0.0
"('anthy', '04.05.2022')",Anthy,Grand lac,4,2022-05-04,85,anthy,G922,0,0.0
"('anthy', '04.05.2022')",Anthy,Grand lac,4,2022-05-04,85,anthy,G931,0,0.0
"('anthy', '04.05.2022')",Anthy,Grand lac,4,2022-05-04,85,anthy,G95,0,0.0
"('anthy', '04.05.2022')",Anthy,Grand lac,4,2022-05-04,85,anthy,G97,0,0.0
"('anthy', '04.05.2022')",Anthy,Grand lac,4,2022-05-04,85,anthy,G159,0,0.0
"('anthy', '04.05.2022')",Anthy,Grand lac,4,2022-05-04,85,anthy,G10,0,0.0
"('anthy', '04.05.2022')",Anthy,Grand lac,4,2022-05-04,85,anthy,G103,0,0.0
"('anthy', '04.05.2022')",Anthy,Grand lac,4,2022-05-04,85,anthy,G106,0,0.0
"('anthy', '04.05.2022')",Anthy,Grand lac,4,2022-05-04,85,anthy,G117,0,0.0
"('anthy', '04.05.2022')",Anthy,Grand lac,4,2022-05-04,85,anthy,G2,0,0.0
"('anthy', '04.05.2022')",Anthy,Grand lac,4,2022-05-04,85,anthy,G25,0,0.0
"('anthy', '04.05.2022')",Anthy,Grand lac,4,2022-05-04,85,anthy,G74,0,0.0
"('anthy', '04.05.2022')",Anthy,Grand lac,4,2022-05-04,85,anthy,G89,0,0.0
"('anthy', '04.05.2022')",Anthy,Grand lac,4,2022-05-04,85,anthy,G125,0,0.0
"('anthy', '04.05.2022')",Anthy,Grand lac,4,2022-05-04,85,anthy,G135,0,0.0
"('anthy', '04.05.2022')",Anthy,Grand lac,4,2022-05-04,85,anthy,G145,0,0.0
"('anthy', '04.05.2022')",Anthy,Grand lac,4,2022-05-04,85,anthy,G29,0,0.0
"('anthy', '04.05.2022')",Anthy,Grand lac,4,2022-05-04,85,anthy,G32,0,0.0
"('anthy', '04.05.2022')",Anthy,Grand lac,4,2022-05-04,85,anthy,G50,0,0.0
"('anthy', '04.05.2022')",Anthy,Grand lac,4,2022-05-04,85,anthy,G99,0,0.0
"('anthy', '04.05.2022')",Anthy,Grand lac,4,2022-05-04,85,anthy,G53,0,0.0
"('anthy', '04.05.2022')",Anthy,Grand lac,4,2022-05-04,85,anthy,G165,0,0.0
"('anthy', '04.05.2022')",Anthy,Grand lac,4,2022-05-04,85,anthy,G137,0,0.0
"('anthy', '04.05.2022')",Anthy,Grand lac,4,2022-05-04,85,anthy,G73,0,0.0
"('anthy', '04.05.2022')",Anthy,Grand lac,4,2022-05-04,85,anthy,G926,0,0.0
"('anthy', '04.05.2022')",Anthy,Grand lac,4,2022-05-04,85,anthy,G126,0,0.0
"('anthy', '04.05.2022')",Anthy,Grand lac,4,2022-05-04,85,anthy,G128,0,0.0
"('anthy', '04.05.2022')",Anthy,Grand lac,4,2022-05-04,85,anthy,G194,0,0.0
"('anthy', '04.05.2022')",Anthy,Grand lac,4,2022-05-04,85,anthy,G26,0,0.0
"('anthy', '04.05.2022')",Anthy,Grand lac,4,2022-05-04,85,anthy,G48,0,0.0
"('anthy', '04.05.2022')",Anthy,Grand lac,4,2022-05-04,85,anthy,G901,0,0.0
"('anthy', '04.05.2022')",Anthy,Grand lac,4,2022-05-04,85,anthy,G929,0,0.0
"('anthy', '04.05.2022')",Anthy,Grand lac,4,2022-05-04,85,anthy,G101,0,0.0
"('anthy', '04.05.2022')",Anthy,Grand lac,4,2022-05-04,85,anthy,G34,0,0.0
"('anthy', '04.05.2022')",Anthy,Grand lac,4,2022-05-04,85,anthy,G100,0,0.0
"('anthy', '04.05.2022')",Anthy,Grand lac,4,2022-05-04,85,anthy,G12,0,0.0
"('anthy', '04.05.2022')",Anthy,Grand lac,4,2022-05-04,85,anthy,G144,0,0.0
"('anthy', '04.05.2022')",Anthy,Grand lac,4,2022-05-04,85,anthy,G18,0,0.0
"('anthy', '04.05.2022')",Anthy,Grand lac,4,2022-05-04,85,anthy,G33,0,0.0
"('anthy', '04.05.2022')",Anthy,Grand lac,4,2022-05-04,85,anthy,G67,0,0.0
"('anthy', '04.05.2022')",Anthy,Grand lac,4,2022-05-04,85,anthy,G90,0,0.0
"('anthy', '04.05.2022')",Anthy,Grand lac,4,2022-05-04,85,anthy,G937,0,0.0
"('anthy', '04.05.2022')",Anthy,Grand lac,4,2022-05-04,85,anthy,G133,0,0.0
"('anthy', '04.05.2022')",Anthy,Grand lac,4,2022-05-04,85,anthy,G28,0,0.0
"('anthy', '04.05.2022')",Anthy,Grand lac,4,2022-05-04,85,anthy,G39,0,0.0
"('anthy', '04.05.2022')",Anthy,Grand lac,4,2022-05-04,85,anthy,G4,0,0.0
"('anthy', '04.05.2022')",Anthy,Grand lac,4,2022-05-04,85,anthy,G54,0,0.0
"('anthy', '04.05.2022')",Anthy,Grand lac,4,2022-05-04,85,anthy,G7,0,0.0
"('anthy', '04.05.2022')",Anthy,Grand lac,4,2022-05-04,85,anthy,G155,0,0.0
"('anthy', '04.05.2022')",Anthy,Grand lac,4,2022-05-04,85,anthy,G127,0,0.0
"('anthy', '04.05.2022')",Anthy,Grand lac,4,2022-05-04,85,anthy,G129,0,0.0
"('anthy', '04.05.2022')",Anthy,Grand lac,4,2022-05-04,85,anthy,G136,0,0.0
"('anthy', '04.05.2022')",Anthy,Grand lac,4,2022-05-04,85,anthy,G80,0,0.0
"('anthy', '04.05.2022')",Anthy,Grand lac,4,2022-05-04,85,anthy,G102,0,0.0
"('anthy', '04.05.2022')",Anthy,Grand lac,4,2022-05-04,85,anthy,G139,0,0.0
"('anthy', '09.02.2022')",Anthy,Grand lac,4,2022-02-09,85,anthy,G113,0,0.0
"('anthy', '09.02.2022')",Anthy,Grand lac,4,2022-02-09,85,anthy,G114,0,0.0
"('anthy', '09.02.2022')",Anthy,Grand lac,4,2022-02-09,85,anthy,G148,0,0.0
"('anthy', '09.02.2022')",Anthy,Grand lac,4,2022-02-09,85,anthy,G21,0,0.0
"('anthy', '09.02.2022')",Anthy,Grand lac,4,2022-02-09,85,anthy,G211,0,0.0
"('anthy', '09.02.2022')",Anthy,Grand lac,4,2022-02-09,85,anthy,G23,0,0.0
"('anthy', '09.02.2022')",Anthy,Grand lac,4,2022-02-09,85,anthy,G24,0,0.0
"('anthy', '09.02.2022')",Anthy,Grand lac,4,2022-02-09,85,anthy,G27,0,0.0
"('anthy', '09.02.2022')",Anthy,Grand lac,4,2022-02-09,85,anthy,G30,0,0.0
"('anthy', '09.02.2022')",Anthy,Grand lac,4,2022-02-09,85,anthy,G31,0,0.0
"('anthy', '09.02.2022')",Anthy,Grand lac,4,2022-02-09,85,anthy,G35,0,0.0
"('anthy', '09.02.2022')",Anthy,Grand lac,4,2022-02-09,85,anthy,G66,0,0.0
"('anthy', '09.02.2022')",Anthy,Grand lac,4,2022-02-09,85,anthy,G70,0,0.0
"('anthy', '09.02.2022')",Anthy,Grand lac,4,2022-02-09,85,anthy,G82,0,0.0
"('anthy', '09.02.2022')",Anthy,Grand lac,4,2022-02-09,85,anthy,G914,0,0.0
"('anthy', '09.02.2022')",Anthy,Grand lac,4,2022-02-09,85,anthy,G922,0,0.0
"('anthy', '09.02.2022')",Anthy,Grand lac,4,2022-02-09,85,anthy,G931,0,0.0
"('anthy', '09.02.2022')",Anthy,Grand lac,4,2022-02-09,85,anthy,G97,0,0.0
"('anthy', '09.02.2022')",Anthy,Grand lac,4,2022-02-09,85,anthy,G159,0,0.0
"('anthy', '09.02.2022')",Anthy,Grand lac,4,2022-02-09,85,anthy,G10,0,0.0
"('anthy', '09.02.2022')",Anthy,Grand lac,4,2022-02-09,85,anthy,G103,0,0.0
"('anthy', '09.02.2022')",Anthy,Grand lac,4,2022-02-09,85,anthy,G106,0,0.0
"('anthy', '09.02.2022')",Anthy,Grand lac,4,2022-02-09,85,anthy,G117,0,0.0
"('anthy', '09.02.2022')",Anthy,Grand lac,4,2022-02-09,85,anthy,G2,0,0.0
"('anthy', '09.02.2022')",Anthy,Grand lac,4,2022-02-09,85,anthy,G25,0,0.0
"('anthy', '09.02.2022')",Anthy,Grand lac,4,2022-02-09,85,anthy,G74,0,0.0
"('anthy', '09.02.2022')",Anthy,Grand lac,4,2022-02-09,85,anthy,G89,0,0.0
"('anthy', '09.02.2022')",Anthy,Grand lac,4,2022-02-09,85,anthy,G125,0,0.0
"('anthy', '09.02.2022')",Anthy,Grand lac,4,2022-02-09,85,anthy,G135,0,0.0
"('anthy', '09.02.2022')",Anthy,Grand lac,4,2022-02-09,85,anthy,G145,0,0.0
"('anthy', '09.02.2022')",Anthy,Grand lac,4,2022-02-09,85,anthy,G29,0,0.0
"('anthy', '09.02.2022')",Anthy,Grand lac,4,2022-02-09,85,anthy,G32,0,0.0
"('anthy', '09.02.2022')",Anthy,Grand lac,4,2022-02-09,85,anthy,G50,0,0.0
"('anthy', '09.02.2022')",Anthy,Grand lac,4,2022-02-09,85,anthy,G99,0,0.0
"('anthy', '09.02.2022')",Anthy,Grand lac,4,2022-02-09,85,anthy,G132,0,0.0
"('anthy', '09.02.2022')",Anthy,Grand lac,4,2022-02-09,85,anthy,G165,0,0.0
"('anthy', '09.02.2022')",Anthy,Grand lac,4,2022-02-09,85,anthy,G137,0,0.0
"('anthy', '09.02.2022')",Anthy,Grand lac,4,2022-02-09,85,anthy,G73,0,0.0
"('anthy', '09.02.2022')",Anthy,Grand lac,4,2022-02-09,85,anthy,G926,0,0.0
"('anthy', '09.02.2022')",Anthy,Grand lac,4,2022-02-09,85,anthy,G126,0,0.0
"('anthy', '09.02.2022')",Anthy,Grand lac,4,2022-02-09,85,anthy,G128,0,0.0
"('anthy', '09.02.2022')",Anthy,Grand lac,4,2022-02-09,85,anthy,G194,0,0.0
"('anthy', '09.02.2022')",Anthy,Grand lac,4,2022-02-09,85,anthy,G26,0,0.0
"('anthy', '09.02.2022')",Anthy,Grand lac,4,2022-02-09,85,anthy,G48,0,0.0
"('anthy', '09.02.2022')",Anthy,Grand lac,4,2022-02-09,85,anthy,G901,0,0.0
"('anthy', '09.02.2022')",Anthy,Grand lac,4,2022-02-09,85,anthy,G929,0,0.0
"('anthy', '09.02.2022')",Anthy,Grand lac,4,2022-02-09,85,anthy,G101,0,0.0
"('anthy', '09.02.2022')",Anthy,Grand lac,4,2022-02-09,85,anthy,G34,0,0.0
"('anthy', '09.02.2022')",Anthy,Grand lac,4,2022-02-09,85,anthy,G100,0,0.0
"('anthy', '09.02.2022')",Anthy,Grand lac,4,2022-02-09,85,anthy,G12,0,0.0
"('anthy', '09.02.2022')",Anthy,Grand lac,4,2022-02-09,85,anthy,G144,0,0.0
"('anthy', '09.02.2022')",Anthy,Grand lac,4,2022-02-09,85,anthy,G18,0,0.0
"('anthy', '09.02.2022')",Anthy,Grand lac,4,2022-02-09,85,anthy,G33,0,0.0
"('anthy', '09.02.2022')",Anthy,Grand lac,4,2022-02-09,85,anthy,G67,0,0.0
"('anthy', '09.02.2022')",Anthy,Grand lac,4,2022-02-09,85,anthy,G90,0,0.0
"('anthy', '09.02.2022')",Anthy,Grand lac,4,2022-02-09,85,anthy,G937,0,0.0
"('anthy', '09.02.2022')",Anthy,Grand lac,4,2022-02-09,85,anthy,G133,0,0.0
"('anthy', '09.02.2022')",Anthy,Grand lac,4,2022-02-09,85,anthy,G28,0,0.0
"('anthy', '09.02.2022')",Anthy,Grand lac,4,2022-02-09,85,anthy,G39,0,0.0
"('anthy', '09.02.2022')",Anthy,Grand lac,4,2022-02-09,85,anthy,G4,0,0.0
"('anthy', '09.02.2022')",Anthy,Grand lac,4,2022-02-09,85,anthy,G54,0,0.0
"('anthy', '09.02.2022')",Anthy,Grand lac,4,2022-02-09,85,anthy,G7,0,0.0
"('anthy', '09.02.2022')",Anthy,Grand lac,4,2022-02-09,85,anthy,G155,0,0.0
"('anthy', '09.02.2022')",Anthy,Grand lac,4,2022-02-09,85,anthy,G127,0,0.0
"('anthy', '09.02.2022')",Anthy,Grand lac,4,2022-02-09,85,anthy,G129,0,0.0
"('anthy', '09.02.2022')",Anthy,Grand lac,4,2022-02-09,85,anthy,G136,0,0.0
"('anthy', '09.02.2022')",Anthy,Grand lac,4,2022-02-09,85,anthy,G80,0,0.0
"('anthy', '09.02.2022')",Anthy,Grand lac,4,2022-02-09,85,anthy,G102,0,0.0
"('anthy', '09.02.2022')",Anthy,Grand lac,4,2022-02-09,85,anthy,G139,0,0.0
"('anthy', '20.07.2022')",Anthy,Grand lac,4,2022-07-20,85,anthy,G113,0,0.0
"('anthy', '20.07.2022')",Anthy,Grand lac,4,2022-07-20,85,anthy,G114,0,0.0
"('anthy', '20.07.2022')",Anthy,Grand lac,4,2022-07-20,85,anthy,G131,0,0.0
"('anthy', '20.07.2022')",Anthy,Grand lac,4,2022-07-20,85,anthy,G148,0,0.0
"('anthy', '20.07.2022')",Anthy,Grand lac,4,2022-07-20,85,anthy,G21,0,0.0
"('anthy', '20.07.2022')",Anthy,Grand lac,4,2022-07-20,85,anthy,G211,0,0.0
"('anthy', '20.07.2022')",Anthy,Grand lac,4,2022-07-20,85,anthy,G23,0,0.0
"('anthy', '20.07.2022')",Anthy,Grand lac,4,2022-07-20,85,anthy,G24,0,0.0
"('anthy', '20.07.2022')",Anthy,Grand lac,4,2022-07-20,85,anthy,G35,0,0.0
"('anthy', '20.07.2022')",Anthy,Grand lac,4,2022-07-20,85,anthy,G66,0,0.0
"('anthy', '20.07.2022')",Anthy,Grand lac,4,2022-07-20,85,anthy,G70,0,0.0
"('anthy', '20.07.2022')",Anthy,Grand lac,4,2022-07-20,85,anthy,G78,0,0.0
"('anthy', '20.07.2022')",Anthy,Grand lac,4,2022-07-20,85,anthy,G79,0,0.0
"('anthy', '20.07.2022')",Anthy,Grand lac,4,2022-07-20,85,anthy,G81,0,0.0
"('anthy', '20.07.2022')",Anthy,Grand lac,4,2022-07-20,85,anthy,G82,0,0.0
"('anthy', '20.07.2022')",Anthy,Grand lac,4,2022-07-20,85,anthy,G905,0,0.0
"('anthy', '20.07.2022')",Anthy,Grand lac,4,2022-07-20,85,anthy,G914,0,0.0
"('anthy', '20.07.2022')",Anthy,Grand lac,4,2022-07-20,85,anthy,G922,0,0.0
"('anthy', '20.07.2022')",Anthy,Grand lac,4,2022-07-20,85,anthy,G931,0,0.0
"('anthy', '20.07.2022')",Anthy,Grand lac,4,2022-07-20,85,anthy,G932,0,0.0
"('anthy', '20.07.2022')",Anthy,Grand lac,4,2022-07-20,85,anthy,G97,0,0.0
"('anthy', '20.07.2022')",Anthy,Grand lac,4,2022-07-20,85,anthy,G159,0,0.0
"('anthy', '20.07.2022')",Anthy,Grand lac,4,2022-07-20,85,anthy,G10,0,0.0
"('anthy', '20.07.2022')",Anthy,Grand lac,4,2022-07-20,85,anthy,G103,0,0.0
"('anthy', '20.07.2022')",Anthy,Grand lac,4,2022-07-20,85,anthy,G106,0,0.0
"('anthy', '20.07.2022')",Anthy,Grand lac,4,2022-07-20,85,anthy,G117,0,0.0
"('anthy', '20.07.2022')",Anthy,Grand lac,4,2022-07-20,85,anthy,G2,0,0.0
"('anthy', '20.07.2022')",Anthy,Grand lac,4,2022-07-20,85,anthy,G25,0,0.0
"('anthy', '20.07.2022')",Anthy,Grand lac,4,2022-07-20,85,anthy,G74,0,0.0
"('anthy', '20.07.2022')",Anthy,Grand lac,4,2022-07-20,85,anthy,G89,0,0.0
"('anthy', '20.07.2022')",Anthy,Grand lac,4,2022-07-20,85,anthy,G112,0,0.0
"('anthy', '20.07.2022')",Anthy,Grand lac,4,2022-07-20,85,anthy,G125,0,0.0
"('anthy', '20.07.2022')",Anthy,Grand lac,4,2022-07-20,85,anthy,G135,0,0.0
"('anthy', '20.07.2022')",Anthy,Grand lac,4,2022-07-20,85,anthy,G145,0,0.0
"('anthy', '20.07.2022')",Anthy,Grand lac,4,2022-07-20,85,anthy,G29,0,0.0
"('anthy', '20.07.2022')",Anthy,Grand lac,4,2022-07-20,85,anthy,G32,0,0.0
"('anthy', '20.07.2022')",Anthy,Grand lac,4,2022-07-20,85,anthy,G99,0,0.0
"('anthy', '20.07.2022')",Anthy,Grand lac,4,2022-07-20,85,anthy,G132,0,0.0
"('anthy', '20.07.2022')",Anthy,Grand lac,4,2022-07-20,85,anthy,G165,0,0.0
"('anthy', '20.07.2022')",Anthy,Grand lac,4,2022-07-20,85,anthy,G137,0,0.0
"('anthy', '20.07.2022')",Anthy,Grand lac,4,2022-07-20,85,anthy,G73,0,0.0
"('anthy', '20.07.2022')",Anthy,Grand lac,4,2022-07-20,85,anthy,G926,0,0.0
"('anthy', '20.07.2022')",Anthy,Grand lac,4,2022-07-20,85,anthy,G126,0,0.0
"('anthy', '20.07.2022')",Anthy,Grand lac,4,2022-07-20,85,anthy,G128,0,0.0
"('anthy', '20.07.2022')",Anthy,Grand lac,4,2022-07-20,85,anthy,G194,0,0.0
"('anthy', '20.07.2022')",Anthy,Grand lac,4,2022-07-20,85,anthy,G26,0,0.0
"('anthy', '20.07.2022')",Anthy,Grand lac,4,2022-07-20,85,anthy,G48,0,0.0
"('anthy', '20.07.2022')",Anthy,Grand lac,4,2022-07-20,85,anthy,G901,0,0.0
"('anthy', '20.07.2022')",Anthy,Grand lac,4,2022-07-20,85,anthy,G929,0,0.0
"('anthy', '20.07.2022')",Anthy,Grand lac,4,2022-07-20,85,anthy,G101,0,0.0
"('anthy', '20.07.2022')",Anthy,Grand lac,4,2022-07-20,85,anthy,G34,0,0.0
"('anthy', '20.07.2022')",Anthy,Grand lac,4,2022-07-20,85,anthy,G100,0,0.0
"('anthy', '20.07.2022')",Anthy,Grand lac,4,2022-07-20,85,anthy,G12,0,0.0
"('anthy', '20.07.2022')",Anthy,Grand lac,4,2022-07-20,85,anthy,G144,0,0.0
"('anthy', '20.07.2022')",Anthy,Grand lac,4,2022-07-20,85,anthy,G18,0,0.0
"('anthy', '20.07.2022')",Anthy,Grand lac,4,2022-07-20,85,anthy,G33,0,0.0
"('anthy', '20.07.2022')",Anthy,Grand lac,4,2022-07-20,85,anthy,G67,0,0.0
"('anthy', '20.07.2022')",Anthy,Grand lac,4,2022-07-20,85,anthy,G90,0,0.0
"('anthy', '20.07.2022')",Anthy,Grand lac,4,2022-07-20,85,anthy,G937,0,0.0
"('anthy', '20.07.2022')",Anthy,Grand lac,4,2022-07-20,85,anthy,G133,0,0.0
"('anthy', '20.07.2022')",Anthy,Grand lac,4,2022-07-20,85,anthy,G28,0,0.0
"('anthy', '20.07.2022')",Anthy,Grand lac,4,2022-07-20,85,anthy,G39,0,0.0
"('anthy', '20.07.2022')",Anthy,Grand lac,4,2022-07-20,85,anthy,G4,0,0.0
"('anthy', '20.07.2022')",Anthy,Grand lac,4,2022-07-20,85,anthy,G54,0,0.0
"('anthy', '20.07.2022')",Anthy,Grand lac,4,2022-07-20,85,anthy,G7,0,0.0
"('anthy', '20.07.2022')",Anthy,Grand lac,4,2022-07-20,85,anthy,G155,0,0.0
"('anthy', '20.07.2022')",Anthy,Grand lac,4,2022-07-20,85,anthy,G127,0,0.0
"('anthy', '20.07.2022')",Anthy,Grand lac,4,2022-07-20,85,anthy,G129,0,0.0
"('anthy', '20.07.2022')",Anthy,Grand lac,4,2022-07-20,85,anthy,G136,0,0.0
"('anthy', '20.07.2022')",Anthy,Grand lac,4,2022-07-20,85,anthy,G80,0,0.0
"('anthy', '20.07.2022')",Anthy,Grand lac,4,2022-07-20,85,anthy,G102,0,0.0
"('anthy', '20.07.2022')",Anthy,Grand lac,4,2022-07-20,85,anthy,G139,0,0.0
"('anthy', '23.11.2022')",Anthy,Grand lac,4,2022-11-23,85,anthy,G113,0,0.0
"('anthy', '23.11.2022')",Anthy,Grand lac,4,2022-11-23,85,anthy,G114,0,0.0
"('anthy', '23.11.2022')",Anthy,Grand lac,4,2022-11-23,85,anthy,G131,0,0.0
"('anthy', '23.11.2022')",Anthy,Grand lac,4,2022-11-23,85,anthy,G148,0,0.0
"('anthy', '23.11.2022')",Anthy,Grand lac,4,2022-11-23,85,anthy,G21,0,0.0
"('anthy', '23.11.2022')",Anthy,Grand lac,4,2022-11-23,85,anthy,G211,0,0.0
"('anthy', '23.11.2022')",Anthy,Grand lac,4,2022-11-23,85,anthy,G23,0,0.0
"('anthy', '23.11.2022')",Anthy,Grand lac,4,2022-11-23,85,anthy,G24,0,0.0
"('anthy', '23.11.2022')",Anthy,Grand lac,4,2022-11-23,85,anthy,G30,0,0.0
"('anthy', '23.11.2022')",Anthy,Grand lac,4,2022-11-23,85,anthy,G31,0,0.0
"('anthy', '23.11.2022')",Anthy,Grand lac,4,2022-11-23,85,anthy,G35,0,0.0
"('anthy', '23.11.2022')",Anthy,Grand lac,4,2022-11-23,85,anthy,G66,0,0.0
"('anthy', '23.11.2022')",Anthy,Grand lac,4,2022-11-23,85,anthy,G70,0,0.0
"('anthy', '23.11.2022')",Anthy,Grand lac,4,2022-11-23,85,anthy,G82,0,0.0
"('anthy', '23.11.2022')",Anthy,Grand lac,4,2022-11-23,85,anthy,G914,0,0.0
"('anthy', '23.11.2022')",Anthy,Grand lac,4,2022-11-23,85,anthy,G922,0,0.0
"('anthy', '23.11.2022')",Anthy,Grand lac,4,2022-11-23,85,anthy,G931,0,0.0
"('anthy', '23.11.2022')",Anthy,Grand lac,4,2022-11-23,85,anthy,G932,0,0.0
"('anthy', '23.11.2022')",Anthy,Grand lac,4,2022-11-23,85,anthy,G95,0,0.0
"('anthy', '23.11.2022')",Anthy,Grand lac,4,2022-11-23,85,anthy,G97,0,0.0
"('anthy', '23.11.2022')",Anthy,Grand lac,4,2022-11-23,85,anthy,G159,0,0.0
"('anthy', '23.11.2022')",Anthy,Grand lac,4,2022-11-23,85,anthy,G10,0,0.0
"('anthy', '23.11.2022')",Anthy,Grand lac,4,2022-11-23,85,anthy,G103,0,0.0
"('anthy', '23.11.2022')",Anthy,Grand lac,4,2022-11-23,85,anthy,G106,0,0.0
"('anthy', '23.11.2022')",Anthy,Grand lac,4,2022-11-23,85,anthy,G117,0,0.0
"('anthy', '23.11.2022')",Anthy,Grand lac,4,2022-11-23,85,anthy,G2,0,0.0
"('anthy', '23.11.2022')",Anthy,Grand lac,4,2022-11-23,85,anthy,G25,0,0.0
"('anthy', '23.11.2022')",Anthy,Grand lac,4,2022-11-23,85,anthy,G74,0,0.0
"('anthy', '23.11.2022')",Anthy,Grand lac,4,2022-11-23,85,anthy,G112,0,0.0
"('anthy', '23.11.2022')",Anthy,Grand lac,4,2022-11-23,85,anthy,G125,0,0.0
"('anthy', '23.11.2022')",Anthy,Grand lac,4,2022-11-23,85,anthy,G135,0,0.0
"('anthy', '23.11.2022')",Anthy,Grand lac,4,2022-11-23,85,anthy,G145,0,0.0
"('anthy', '23.11.2022')",Anthy,Grand lac,4,2022-11-23,85,anthy,G29,0,0.0
"('anthy', '23.11.2022')",Anthy,Grand lac,4,2022-11-23,85,anthy,G32,0,0.0
"('anthy', '23.11.2022')",Anthy,Grand lac,4,2022-11-23,85,anthy,G50,0,0.0
"('anthy', '23.11.2022')",Anthy,Grand lac,4,2022-11-23,85,anthy,G99,0,0.0
"('anthy', '23.11.2022')",Anthy,Grand lac,4,2022-11-23,85,anthy,G132,0,0.0
"('anthy', '23.11.2022')",Anthy,Grand lac,4,2022-11-23,85,anthy,G53,0,0.0
"('anthy', '23.11.2022')",Anthy,Grand lac,4,2022-11-23,85,anthy,G165,0,0.0
"('anthy', '23.11.2022')",Anthy,Grand lac,4,2022-11-23,85,anthy,G137,0,0.0
"('anthy', '23.11.2022')",Anthy,Grand lac,4,2022-11-23,85,anthy,G73,0,0.0
"('anthy', '23.11.2022')",Anthy,Grand lac,4,2022-11-23,85,anthy,G926,0,0.0
"('anthy', '23.11.2022')",Anthy,Grand lac,4,2022-11-23,85,anthy,G126,0,0.0
"('anthy', '23.11.2022')",Anthy,Grand lac,4,2022-11-23,85,anthy,G128,0,0.0
"('anthy', '23.11.2022')",Anthy,Grand lac,4,2022-11-23,85,anthy,G194,0,0.0
"('anthy', '23.11.2022')",Anthy,Grand lac,4,2022-11-23,85,anthy,G26,0,0.0
"('anthy', '23.11.2022')",Anthy,Grand lac,4,2022-11-23,85,anthy,G48,0,0.0
"('anthy', '23.11.2022')",Anthy,Grand lac,4,2022-11-23,85,anthy,G901,0,0.0
"('anthy', '23.11.2022')",Anthy,Grand lac,4,2022-11-23,85,anthy,G929,0,0.0
"('anthy', '23.11.2022')",Anthy,Grand lac,4,2022-11-23,85,anthy,G101,0,0.0
"('anthy', '23.11.2022')",Anthy,Grand lac,4,2022-11-23,85,anthy,G34,0,0.0
"('anthy', '23.11.2022')",Anthy,Grand lac,4,2022-11-23,85,anthy,G100,0,0.0
"('anthy', '23.11.2022')",Anthy,Grand lac,4,2022-11-23,85,anthy,G12,0,0.0
"('anthy', '23.11.2022')",Anthy,Grand lac,4,2022-11-23,85,anthy,G144,0,0.0
"('anthy', '23.11.2022')",Anthy,Grand lac,4,2022-11-23,85,anthy,G18,0,0.0
"('anthy', '23.11.2022')",Anthy,Grand lac,4,2022-11-23,85,anthy,G33,0,0.0
"('anthy', '23.11.2022')",Anthy,Grand lac,4,2022-11-23,85,anthy,G67,0,0.0
"('anthy', '23.11.2022')",Anthy,Grand lac,4,2022-11-23,85,anthy,G90,0,0.0
"('anthy', '23.11.2022')",Anthy,Grand lac,4,2022-11-23,85,anthy,G937,0,0.0
"('anthy', '23.11.2022')",Anthy,Grand lac,4,2022-11-23,85,anthy,G133,0,0.0
"('anthy', '23.11.2022')",Anthy,Grand lac,4,2022-11-23,85,anthy,G28,0,0.0
"('anthy', '23.11.2022')",Anthy,Grand lac,4,2022-11-23,85,anthy,G39,0,0.0
"('anthy', '23.11.2022')",Anthy,Grand lac,4,2022-11-23,85,anthy,G4,0,0.0
"('anthy', '23.11.2022')",Anthy,Grand lac,4,2022-11-23,85,anthy,G54,0,0.0
"('anthy', '23.11.2022')",Anthy,Grand lac,4,2022-11-23,85,anthy,G7,0,0.0
"('anthy', '23.11.2022')",Anthy,Grand lac,4,2022-11-23,85,anthy,G155,0,0.0
"('anthy', '23.11.2022')",Anthy,Grand lac,4,2022-11-23,85,anthy,G127,0,0.0
"('anthy', '23.11.2022')",Anthy,Grand lac,4,2022-11-23,85,anthy,G129,0,0.0
"('anthy', '23.11.2022')",Anthy,Grand lac,4,2022-11-23,85,anthy,G136,0,0.0
"('anthy', '23.11.2022')",Anthy,Grand lac,4,2022-11-23,85,anthy,G80,0,0.0
"('anthy', '23.11.2022')",Anthy,Grand lac,4,2022-11-23,85,anthy,G102,0,0.0
"('anthy', '23.11.2022')",Anthy,Grand lac,4,2022-11-23,85,anthy,G139,0,0.0
"('aubonne', '05.11.2022')",Aubonne,Grand lac,4,2022-11-05,50,aubonne,G114,0,0.0
"('aubonne', '05.11.2022')",Aubonne,Grand lac,4,2022-11-05,50,aubonne,G131,0,0.0
"('aubonne', '05.11.2022')",Aubonne,Grand lac,4,2022-11-05,50,aubonne,G148,0,0.0
"('aubonne', '05.11.2022')",Aubonne,Grand lac,4,2022-11-05,50,aubonne,G211,0,0.0
"('aubonne', '05.11.2022')",Aubonne,Grand lac,4,2022-11-05,50,aubonne,G23,0,0.0
"('aubonne', '05.11.2022')",Aubonne,Grand lac,4,2022-11-05,50,aubonne,G24,0,0.0
"('aubonne', '05.11.2022')",Aubonne,Grand lac,4,2022-11-05,50,aubonne,G35,0,0.0
"('aubonne', '05.11.2022')",Aubonne,Grand lac,4,2022-11-05,50,aubonne,G66,0,0.0
"('aubonne', '05.11.2022')",Aubonne,Grand lac,4,2022-11-05,50,aubonne,G70,0,0.0
"('aubonne', '05.11.2022')",Aubonne,Grand lac,4,2022-11-05,50,aubonne,G82,0,0.0
"('aubonne', '05.11.2022')",Aubonne,Grand lac,4,2022-11-05,50,aubonne,G905,0,0.0
"('aubonne', '05.11.2022')",Aubonne,Grand lac,4,2022-11-05,50,aubonne,G914,0,0.0
"('aubonne', '05.11.2022')",Aubonne,Grand lac,4,2022-11-05,50,aubonne,G922,0,0.0
"('aubonne', '05.11.2022')",Aubonne,Grand lac,4,2022-11-05,50,aubonne,G931,0,0.0
"('aubonne', '05.11.2022')",Aubonne,Grand lac,4,2022-11-05,50,aubonne,G95,0,0.0
"('aubonne', '05.11.2022')",Aubonne,Grand lac,4,2022-11-05,50,aubonne,G97,0,0.0
"('aubonne', '05.11.2022')",Aubonne,Grand lac,4,2022-11-05,50,aubonne,G159,0,0.0
"('aubonne', '05.11.2022')",Aubonne,Grand lac,4,2022-11-05,50,aubonne,G10,0,0.0
"('aubonne', '05.11.2022')",Aubonne,Grand lac,4,2022-11-05,50,aubonne,G2,0,0.0
"('aubonne', '05.11.2022')",Aubonne,Grand lac,4,2022-11-05,50,aubonne,G25,0,0.0
"('aubonne', '05.11.2022')",Aubonne,Grand lac,4,2022-11-05,50,aubonne,G74,0,0.0
"('aubonne', '05.11.2022')",Aubonne,Grand lac,4,2022-11-05,50,aubonne,G89,0,0.0
"('aubonne', '05.11.2022')",Aubonne,Grand lac,4,2022-11-05,50,aubonne,G112,0,0.0
"('aubonne', '05.11.2022')",Aubonne,Grand lac,4,2022-11-05,50,aubonne,G125,0,0.0
"('aubonne', '05.11.2022')",Aubonne,Grand lac,4,2022-11-05,50,aubonne,G135,0,0.0
"('aubonne', '05.11.2022')",Aubonne,Grand lac,4,2022-11-05,50,aubonne,G145,0,0.0
"('aubonne', '05.11.2022')",Aubonne,Grand lac,4,2022-11-05,50,aubonne,G29,0,0.0
"('aubonne', '05.11.2022')",Aubonne,Grand lac,4,2022-11-05,50,aubonne,G32,0,0.0
"('aubonne', '05.11.2022')",Aubonne,Grand lac,4,2022-11-05,50,aubonne,G50,0,0.0
"('aubonne', '05.11.2022')",Aubonne,Grand lac,4,2022-11-05,50,aubonne,G99,0,0.0
"('aubonne', '05.11.2022')",Aubonne,Grand lac,4,2022-11-05,50,aubonne,G132,0,0.0
"('aubonne', '05.11.2022')",Aubonne,Grand lac,4,2022-11-05,50,aubonne,G53,0,0.0
"('aubonne', '05.11.2022')",Aubonne,Grand lac,4,2022-11-05,50,aubonne,G165,0,0.0
"('aubonne', '05.11.2022')",Aubonne,Grand lac,4,2022-11-05,50,aubonne,G137,0,0.0
"('aubonne', '05.11.2022')",Aubonne,Grand lac,4,2022-11-05,50,aubonne,G73,0,0.0
"('aubonne', '05.11.2022')",Aubonne,Grand lac,4,2022-11-05,50,aubonne,G926,0,0.0
"('aubonne', '05.11.2022')",Aubonne,Grand lac,4,2022-11-05,50,aubonne,G126,0,0.0
"('aubonne', '05.11.2022')",Aubonne,Grand lac,4,2022-11-05,50,aubonne,G128,0,0.0
"('aubonne', '05.11.2022')",Aubonne,Grand lac,4,2022-11-05,50,aubonne,G194,0,0.0
"('aubonne', '05.11.2022')",Aubonne,Grand lac,4,2022-11-05,50,aubonne,G26,0,0.0
"('aubonne', '05.11.2022')",Aubonne,Grand lac,4,2022-11-05,50,aubonne,G48,0,0.0
"('aubonne', '05.11.2022')",Aubonne,Grand lac,4,2022-11-05,50,aubonne,G901,0,0.0
"('aubonne', '05.11.2022')",Aubonne,Grand lac,4,2022-11-05,50,aubonne,G929,0,0.0
"('aubonne', '05.11.2022')",Aubonne,Grand lac,4,2022-11-05,50,aubonne,G101,0,0.0
"('aubonne', '05.11.2022')",Aubonne,Grand lac,4,2022-11-05,50,aubonne,G34,0,0.0
"('aubonne', '05.11.2022')",Aubonne,Grand lac,4,2022-11-05,50,aubonne,G100,0,0.0
"('aubonne', '05.11.2022')",Aubonne,Grand lac,4,2022-11-05,50,aubonne,G12,0,0.0
"('aubonne', '05.11.2022')",Aubonne,Grand lac,4,2022-11-05,50,aubonne,G144,0,0.0
"('aubonne', '05.11.2022')",Aubonne,Grand lac,4,2022-11-05,50,aubonne,G18,0,0.0
"('aubonne', '05.11.2022')",Aubonne,Grand lac,4,2022-11-05,50,aubonne,G33,0,0.0
"('aubonne', '05.11.2022')",Aubonne,Grand lac,4,2022-11-05,50,aubonne,G67,0,0.0
"('aubonne', '05.11.2022')",Aubonne,Grand lac,4,2022-11-05,50,aubonne,G90,0,0.0
"('aubonne', '05.11.2022')",Aubonne,Grand lac,4,2022-11-05,50,aubonne,G937,0,0.0
"('aubonne', '05.11.2022')",Aubonne,Grand lac,4,2022-11-05,50,aubonne,G133,0,0.0
"('aubonne', '05.11.2022')",Aubonne,Grand lac,4,2022-11-05,50,aubonne,G28,0,0.0
"('aubonne', '05.11.2022')",Aubonne,Grand lac,4,2022-11-05,50,aubonne,G39,0,0.0
"('aubonne', '05.11.2022')",Aubonne,Grand lac,4,2022-11-05,50,aubonne,G4,0,0.0
"('aubonne', '05.11.2022')",Aubonne,Grand lac,4,2022-11-05,50,aubonne,G54,0,0.0
"('aubonne', '05.11.2022')",Aubonne,Grand lac,4,2022-11-05,50,aubonne,G7,0,0.0
"('aubonne', '05.11.2022')",Aubonne,Grand lac,4,2022-11-05,50,aubonne,G155,0,0.0
"('aubonne', '05.11.2022')",Aubonne,Grand lac,4,2022-11-05,50,aubonne,G127,0,0.0
"('aubonne', '05.11.2022')",Aubonne,Grand lac,4,2022-11-05,50,aubonne,G129,0,0.0
"('aubonne', '05.11.2022')",Aubonne,Grand lac,4,2022-11-05,50,aubonne,G136,0,0.0
"('aubonne', '05.11.2022')",Aubonne,Grand lac,4,2022-11-05,50,aubonne,G80,0,0.0
"('aubonne', '05.11.2022')",Aubonne,Grand lac,4,2022-11-05,50,aubonne,G102,0,0.0
"('aubonne', '05.11.2022')",Aubonne,Grand lac,4,2022-11-05,50,aubonne,G139,0,0.0
"('aubonne', '06.02.2022')",Aubonne,Grand lac,4,2022-02-06,50,aubonne,G114,0,0.0
"('aubonne', '06.02.2022')",Aubonne,Grand lac,4,2022-02-06,50,aubonne,G131,0,0.0
"('aubonne', '06.02.2022')",Aubonne,Grand lac,4,2022-02-06,50,aubonne,G148,0,0.0
"('aubonne', '06.02.2022')",Aubonne,Grand lac,4,2022-02-06,50,aubonne,G21,0,0.0
"('aubonne', '06.02.2022')",Aubonne,Grand lac,4,2022-02-06,50,aubonne,G211,0,0.0
"('aubonne', '06.02.2022')",Aubonne,Grand lac,4,2022-02-06,50,aubonne,G31,0,0.0
"('aubonne', '06.02.2022')",Aubonne,Grand lac,4,2022-02-06,50,aubonne,G35,0,0.0
"('aubonne', '06.02.2022')",Aubonne,Grand lac,4,2022-02-06,50,aubonne,G66,0,0.0
"('aubonne', '06.02.2022')",Aubonne,Grand lac,4,2022-02-06,50,aubonne,G70,0,0.0
"('aubonne', '06.02.2022')",Aubonne,Grand lac,4,2022-02-06,50,aubonne,G82,0,0.0
"('aubonne', '06.02.2022')",Aubonne,Grand lac,4,2022-02-06,50,aubonne,G905,0,0.0
"('aubonne', '06.02.2022')",Aubonne,Grand lac,4,2022-02-06,50,aubonne,G914,0,0.0
"('aubonne', '06.02.2022')",Aubonne,Grand lac,4,2022-02-06,50,aubonne,G922,0,0.0
"('aubonne', '06.02.2022')",Aubonne,Grand lac,4,2022-02-06,50,aubonne,G931,0,0.0
"('aubonne', '06.02.2022')",Aubonne,Grand lac,4,2022-02-06,50,aubonne,G932,0,0.0
"('aubonne', '06.02.2022')",Aubonne,Grand lac,4,2022-02-06,50,aubonne,G95,0,0.0
"('aubonne', '06.02.2022')",Aubonne,Grand lac,4,2022-02-06,50,aubonne,G97,0,0.0
"('aubonne', '06.02.2022')",Aubonne,Grand lac,4,2022-02-06,50,aubonne,G159,0,0.0
"('aubonne', '06.02.2022')",Aubonne,Grand lac,4,2022-02-06,50,aubonne,G10,0,0.0
"('aubonne', '06.02.2022')",Aubonne,Grand lac,4,2022-02-06,50,aubonne,G2,0,0.0
"('aubonne', '06.02.2022')",Aubonne,Grand lac,4,2022-02-06,50,aubonne,G25,0,0.0
"('aubonne', '06.02.2022')",Aubonne,Grand lac,4,2022-02-06,50,aubonne,G89,0,0.0
"('aubonne', '06.02.2022')",Aubonne,Grand lac,4,2022-02-06,50,aubonne,G112,0,0.0
"('aubonne', '06.02.2022')",Aubonne,Grand lac,4,2022-02-06,50,aubonne,G125,0,0.0
"('aubonne', '06.02.2022')",Aubonne,Grand lac,4,2022-02-06,50,aubonne,G135,0,0.0
"('aubonne', '06.02.2022')",Aubonne,Grand lac,4,2022-02-06,50,aubonne,G145,0,0.0
"('aubonne', '06.02.2022')",Aubonne,Grand lac,4,2022-02-06,50,aubonne,G29,0,0.0
"('aubonne', '06.02.2022')",Aubonne,Grand lac,4,2022-02-06,50,aubonne,G32,0,0.0
"('aubonne', '06.02.2022')",Aubonne,Grand lac,4,2022-02-06,50,aubonne,G50,0,0.0
"('aubonne', '06.02.2022')",Aubonne,Grand lac,4,2022-02-06,50,aubonne,G99,0,0.0
"('aubonne', '06.02.2022')",Aubonne,Grand lac,4,2022-02-06,50,aubonne,G53,0,0.0
"('aubonne', '06.02.2022')",Aubonne,Grand lac,4,2022-02-06,50,aubonne,G137,0,0.0
"('aubonne', '06.02.2022')",Aubonne,Grand lac,4,2022-02-06,50,aubonne,G73,0,0.0
"('aubonne', '06.02.2022')",Aubonne,Grand lac,4,2022-02-06,50,aubonne,G926,0,0.0
"('aubonne', '06.02.2022')",Aubonne,Grand lac,4,2022-02-06,50,aubonne,G126,0,0.0
"('aubonne', '06.02.2022')",Aubonne,Grand lac,4,2022-02-06,50,aubonne,G128,0,0.0
"('aubonne', '06.02.2022')",Aubonne,Grand lac,4,2022-02-06,50,aubonne,G194,0,0.0
"('aubonne', '06.02.2022')",Aubonne,Grand lac,4,2022-02-06,50,aubonne,G26,0,0.0
"('aubonne', '06.02.2022')",Aubonne,Grand lac,4,2022-02-06,50,aubonne,G48,0,0.0
"('aubonne', '06.02.2022')",Aubonne,Grand lac,4,2022-02-06,50,aubonne,G901,0,0.0
"('aubonne', '06.02.2022')",Aubonne,Grand lac,4,2022-02-06,50,aubonne,G929,0,0.0
"('aubonne', '06.02.2022')",Aubonne,Grand lac,4,2022-02-06,50,aubonne,G101,0,0.0
"('aubonne', '06.02.2022')",Aubonne,Grand lac,4,2022-02-06,50,aubonne,G34,0,0.0
"('aubonne', '06.02.2022')",Aubonne,Grand lac,4,2022-02-06,50,aubonne,G100,0,0.0
"('aubonne', '06.02.2022')",Aubonne,Grand lac,4,2022-02-06,50,aubonne,G12,0,0.0
"('aubonne', '06.02.2022')",Aubonne,Grand lac,4,2022-02-06,50,aubonne,G144,0,0.0
"('aubonne', '06.02.2022')",Aubonne,Grand lac,4,2022-02-06,50,aubonne,G18,0,0.0
"('aubonne', '06.02.2022')",Aubonne,Grand lac,4,2022-02-06,50,aubonne,G33,0,0.0
"('aubonne', '06.02.2022')",Aubonne,Grand lac,4,2022-02-06,50,aubonne,G67,0,0.0
"('aubonne', '06.02.2022')",Aubonne,Grand lac,4,2022-02-06,50,aubonne,G90,0,0.0
"('aubonne', '06.02.2022')",Aubonne,Grand lac,4,2022-02-06,50,aubonne,G937,0,0.0
"('aubonne', '06.02.2022')",Aubonne,Grand lac,4,2022-02-06,50,aubonne,G133,0,0.0
"('aubonne', '06.02.2022')",Aubonne,Grand lac,4,2022-02-06,50,aubonne,G28,0,0.0
"('aubonne', '06.02.2022')",Aubonne,Grand lac,4,2022-02-06,50,aubonne,G39,0,0.0
"('aubonne', '06.02.2022')",Aubonne,Grand lac,4,2022-02-06,50,aubonne,G4,0,0.0
"('aubonne', '06.02.2022')",Aubonne,Grand lac,4,2022-02-06,50,aubonne,G54,0,0.0
"('aubonne', '06.02.2022')",Aubonne,Grand lac,4,2022-02-06,50,aubonne,G7,0,0.0
"('aubonne', '06.02.2022')",Aubonne,Grand lac,4,2022-02-06,50,aubonne,G155,0,0.0
"('aubonne', '06.02.2022')",Aubonne,Grand lac,4,2022-02-06,50,aubonne,G127,0,0.0
"('aubonne', '06.02.2022')",Aubonne,Grand lac,4,2022-02-06,50,aubonne,G129,0,0.0
"('aubonne', '06.02.2022')",Aubonne,Grand lac,4,2022-02-06,50,aubonne,G136,0,0.0
"('aubonne', '06.02.2022')",Aubonne,Grand lac,4,2022-02-06,50,aubonne,G80,0,0.0
"('aubonne', '06.02.2022')",Aubonne,Grand lac,4,2022-02-06,50,aubonne,G102,0,0.0
"('aubonne', '06.02.2022')",Aubonne,Grand lac,4,2022-02-06,50,aubonne,G139,0,0.0
"('aubonne', '10.09.2022')",Aubonne,Grand lac,4,2022-09-10,50,aubonne,G114,0,0.0
"('aubonne', '10.09.2022')",Aubonne,Grand lac,4,2022-09-10,50,aubonne,G131,0,0.0
"('aubonne', '10.09.2022')",Aubonne,Grand lac,4,2022-09-10,50,aubonne,G148,0,0.0
"('aubonne', '10.09.2022')",Aubonne,Grand lac,4,2022-09-10,50,aubonne,G211,0,0.0
"('aubonne', '10.09.2022')",Aubonne,Grand lac,4,2022-09-10,50,aubonne,G23,0,0.0
"('aubonne', '10.09.2022')",Aubonne,Grand lac,4,2022-09-10,50,aubonne,G31,0,0.0
"('aubonne', '10.09.2022')",Aubonne,Grand lac,4,2022-09-10,50,aubonne,G35,0,0.0
"('aubonne', '10.09.2022')",Aubonne,Grand lac,4,2022-09-10,50,aubonne,G66,0,0.0
"('aubonne', '10.09.2022')",Aubonne,Grand lac,4,2022-09-10,50,aubonne,G70,0,0.0
"('aubonne', '10.09.2022')",Aubonne,Grand lac,4,2022-09-10,50,aubonne,G905,0,0.0
"('aubonne', '10.09.2022')",Aubonne,Grand lac,4,2022-09-10,50,aubonne,G914,0,0.0
"('aubonne', '10.09.2022')",Aubonne,Grand lac,4,2022-09-10,50,aubonne,G922,0,0.0
"('aubonne', '10.09.2022')",Aubonne,Grand lac,4,2022-09-10,50,aubonne,G931,0,0.0
"('aubonne', '10.09.2022')",Aubonne,Grand lac,4,2022-09-10,50,aubonne,G932,0,0.0
"('aubonne', '10.09.2022')",Aubonne,Grand lac,4,2022-09-10,50,aubonne,G95,0,0.0
"('aubonne', '10.09.2022')",Aubonne,Grand lac,4,2022-09-10,50,aubonne,G97,0,0.0
"('aubonne', '10.09.2022')",Aubonne,Grand lac,4,2022-09-10,50,aubonne,G159,0,0.0
"('aubonne', '10.09.2022')",Aubonne,Grand lac,4,2022-09-10,50,aubonne,G10,0,0.0
"('aubonne', '10.09.2022')",Aubonne,Grand lac,4,2022-09-10,50,aubonne,G25,0,0.0
"('aubonne', '10.09.2022')",Aubonne,Grand lac,4,2022-09-10,50,aubonne,G74,0,0.0
"('aubonne', '10.09.2022')",Aubonne,Grand lac,4,2022-09-10,50,aubonne,G89,0,0.0
"('aubonne', '10.09.2022')",Aubonne,Grand lac,4,2022-09-10,50,aubonne,G112,0,0.0
"('aubonne', '10.09.2022')",Aubonne,Grand lac,4,2022-09-10,50,aubonne,G125,0,0.0
"('aubonne', '10.09.2022')",Aubonne,Grand lac,4,2022-09-10,50,aubonne,G135,0,0.0
"('aubonne', '10.09.2022')",Aubonne,Grand lac,4,2022-09-10,50,aubonne,G145,0,0.0
"('aubonne', '10.09.2022')",Aubonne,Grand lac,4,2022-09-10,50,aubonne,G29,0,0.0
"('aubonne', '10.09.2022')",Aubonne,Grand lac,4,2022-09-10,50,aubonne,G99,0,0.0
"('aubonne', '10.09.2022')",Aubonne,Grand lac,4,2022-09-10,50,aubonne,G132,0,0.0
"('aubonne', '10.09.2022')",Aubonne,Grand lac,4,2022-09-10,50,aubonne,G53,0,0.0
"('aubonne', '10.09.2022')",Aubonne,Grand lac,4,2022-09-10,50,aubonne,G137,0,0.0
"('aubonne', '10.09.2022')",Aubonne,Grand lac,4,2022-09-10,50,aubonne,G73,0,0.0
"('aubonne', '10.09.2022')",Aubonne,Grand lac,4,2022-09-10,50,aubonne,G926,0,0.0
"('aubonne', '10.09.2022')",Aubonne,Grand lac,4,2022-09-10,50,aubonne,G126,0,0.0
"('aubonne', '10.09.2022')",Aubonne,Grand lac,4,2022-09-10,50,aubonne,G128,0,0.0
"('aubonne', '10.09.2022')",Aubonne,Grand lac,4,2022-09-10,50,aubonne,G194,0,0.0
"('aubonne', '10.09.2022')",Aubonne,Grand lac,4,2022-09-10,50,aubonne,G26,0,0.0
"('aubonne', '10.09.2022')",Aubonne,Grand lac,4,2022-09-10,50,aubonne,G48,0,0.0
"('aubonne', '10.09.2022')",Aubonne,Grand lac,4,2022-09-10,50,aubonne,G901,0,0.0
"('aubonne', '10.09.2022')",Aubonne,Grand lac,4,2022-09-10,50,aubonne,G929,0,0.0
"('aubonne', '10.09.2022')",Aubonne,Grand lac,4,2022-09-10,50,aubonne,G101,0,0.0
"('aubonne', '10.09.2022')",Aubonne,Grand lac,4,2022-09-10,50,aubonne,G34,0,0.0
"('aubonne', '10.09.2022')",Aubonne,Grand lac,4,2022-09-10,50,aubonne,G100,0,0.0
"('aubonne', '10.09.2022')",Aubonne,Grand lac,4,2022-09-10,50,aubonne,G12,0,0.0
"('aubonne', '10.09.2022')",Aubonne,Grand lac,4,2022-09-10,50,aubonne,G144,0,0.0
"('aubonne', '10.09.2022')",Aubonne,Grand lac,4,2022-09-10,50,aubonne,G18,0,0.0
"('aubonne', '10.09.2022')",Aubonne,Grand lac,4,2022-09-10,50,aubonne,G33,0,0.0
"('aubonne', '10.09.2022')",Aubonne,Grand lac,4,2022-09-10,50,aubonne,G67,0,0.0
"('aubonne', '10.09.2022')",Aubonne,Grand lac,4,2022-09-10,50,aubonne,G90,0,0.0
"('aubonne', '10.09.2022')",Aubonne,Grand lac,4,2022-09-10,50,aubonne,G937,0,0.0
"('aubonne', '10.09.2022')",Aubonne,Grand lac,4,2022-09-10,50,aubonne,G133,0,0.0
"('aubonne', '10.09.2022')",Aubonne,Grand lac,4,2022-09-10,50,aubonne,G28,0,0.0
"('aubonne', '10.09.2022')",Aubonne,Grand lac,4,2022-09-10,50,aubonne,G39,0,0.0
"('aubonne', '10.09.2022')",Aubonne,Grand lac,4,2022-09-10,50,aubonne,G4,0,0.0
"('aubonne', '10.09.2022')",Aubonne,Grand lac,4,2022-09-10,50,aubonne,G54,0,0.0
"('aubonne', '10.09.2022')",Aubonne,Grand lac,4,2022-09-10,50,aubonne,G7,0,0.0
"('aubonne', '10.09.2022')",Aubonne,Grand lac,4,2022-09-10,50,aubonne,G155,0,0.0
"('aubonne', '10.09.2022')",Aubonne,Grand lac,4,2022-09-10,50,aubonne,G127,0,0.0
"('aubonne', '10.09.2022')",Aubonne,Grand lac,4,2022-09-10,50,aubonne,G129,0,0.0
"('aubonne', '10.09.2022')",Aubonne,Grand lac,4,2022-09-10,50,aubonne,G136,0,0.0
"('aubonne', '10.09.2022')",Aubonne,Grand lac,4,2022-09-10,50,aubonne,G80,0,0.0
"('aubonne', '10.09.2022')",Aubonne,Grand lac,4,2022-09-10,50,aubonne,G102,0,0.0
"('aubonne', '10.09.2022')",Aubonne,Grand lac,4,2022-09-10,50,aubonne,G139,0,0.0
"('aubonne', '14.05.2022')",Aubonne,Grand lac,4,2022-05-14,50,aubonne,G113,0,0.0
"('aubonne', '14.05.2022')",Aubonne,Grand lac,4,2022-05-14,50,aubonne,G114,0,0.0
"('aubonne', '14.05.2022')",Aubonne,Grand lac,4,2022-05-14,50,aubonne,G131,0,0.0
"('aubonne', '14.05.2022')",Aubonne,Grand lac,4,2022-05-14,50,aubonne,G148,0,0.0
"('aubonne', '14.05.2022')",Aubonne,Grand lac,4,2022-05-14,50,aubonne,G211,0,0.0
"('aubonne', '14.05.2022')",Aubonne,Grand lac,4,2022-05-14,50,aubonne,G24,0,0.0
"('aubonne', '14.05.2022')",Aubonne,Grand lac,4,2022-05-14,50,aubonne,G35,0,0.0
"('aubonne', '14.05.2022')",Aubonne,Grand lac,4,2022-05-14,50,aubonne,G70,0,0.0
"('aubonne', '14.05.2022')",Aubonne,Grand lac,4,2022-05-14,50,aubonne,G82,0,0.0
"('aubonne', '14.05.2022')",Aubonne,Grand lac,4,2022-05-14,50,aubonne,G905,0,0.0
"('aubonne', '14.05.2022')",Aubonne,Grand lac,4,2022-05-14,50,aubonne,G914,0,0.0
"('aubonne', '14.05.2022')",Aubonne,Grand lac,4,2022-05-14,50,aubonne,G922,0,0.0
"('aubonne', '14.05.2022')",Aubonne,Grand lac,4,2022-05-14,50,aubonne,G931,0,0.0
"('aubonne', '14.05.2022')",Aubonne,Grand lac,4,2022-05-14,50,aubonne,G932,0,0.0
"('aubonne', '14.05.2022')",Aubonne,Grand lac,4,2022-05-14,50,aubonne,G95,0,0.0
"('aubonne', '14.05.2022')",Aubonne,Grand lac,4,2022-05-14,50,aubonne,G97,0,0.0
"('aubonne', '14.05.2022')",Aubonne,Grand lac,4,2022-05-14,50,aubonne,G159,0,0.0
"('aubonne', '14.05.2022')",Aubonne,Grand lac,4,2022-05-14,50,aubonne,G10,0,0.0
"('aubonne', '14.05.2022')",Aubonne,Grand lac,4,2022-05-14,50,aubonne,G103,0,0.0
"('aubonne', '14.05.2022')",Aubonne,Grand lac,4,2022-05-14,50,aubonne,G2,0,0.0
"('aubonne', '14.05.2022')",Aubonne,Grand lac,4,2022-05-14,50,aubonne,G25,0,0.0
"('aubonne', '14.05.2022')",Aubonne,Grand lac,4,2022-05-14,50,aubonne,G74,0,0.0
"('aubonne', '14.05.2022')",Aubonne,Grand lac,4,2022-05-14,50,aubonne,G89,0,0.0
"('aubonne', '14.05.2022')",Aubonne,Grand lac,4,2022-05-14,50,aubonne,G112,0,0.0
"('aubonne', '14.05.2022')",Aubonne,Grand lac,4,2022-05-14,50,aubonne,G135,0,0.0
"('aubonne', '14.05.2022')",Aubonne,Grand lac,4,2022-05-14,50,aubonne,G145,0,0.0
"('aubonne', '14.05.2022')",Aubonne,Grand lac,4,2022-05-14,50,aubonne,G29,0,0.0
"('aubonne', '14.05.2022')",Aubonne,Grand lac,4,2022-05-14,50,aubonne,G32,0,0.0
"('aubonne', '14.05.2022')",Aubonne,Grand lac,4,2022-05-14,50,aubonne,G50,0,0.0
"('aubonne', '14.05.2022')",Aubonne,Grand lac,4,2022-05-14,50,aubonne,G99,0,0.0
"('aubonne', '14.05.2022')",Aubonne,Grand lac,4,2022-05-14,50,aubonne,G53,0,0.0
"('aubonne', '14.05.2022')",Aubonne,Grand lac,4,2022-05-14,50,aubonne,G165,0,0.0
"('aubonne', '14.05.2022')",Aubonne,Grand lac,4,2022-05-14,50,aubonne,G137,0,0.0
"('aubonne', '14.05.2022')",Aubonne,Grand lac,4,2022-05-14,50,aubonne,G73,0,0.0
"('aubonne', '14.05.2022')",Aubonne,Grand lac,4,2022-05-14,50,aubonne,G926,0,0.0
"('aubonne', '14.05.2022')",Aubonne,Grand lac,4,2022-05-14,50,aubonne,G126,0,0.0
"('aubonne', '14.05.2022')",Aubonne,Grand lac,4,2022-05-14,50,aubonne,G128,0,0.0
"('aubonne', '14.05.2022')",Aubonne,Grand lac,4,2022-05-14,50,aubonne,G194,0,0.0
"('aubonne', '14.05.2022')",Aubonne,Grand lac,4,2022-05-14,50,aubonne,G26,0,0.0
"('aubonne', '14.05.2022')",Aubonne,Grand lac,4,2022-05-14,50,aubonne,G48,0,0.0
"('aubonne', '14.05.2022')",Aubonne,Grand lac,4,2022-05-14,50,aubonne,G901,0,0.0
"('aubonne', '14.05.2022')",Aubonne,Grand lac,4,2022-05-14,50,aubonne,G929,0,0.0
"('aubonne', '14.05.2022')",Aubonne,Grand lac,4,2022-05-14,50,aubonne,G101,0,0.0
"('aubonne', '14.05.2022')",Aubonne,Grand lac,4,2022-05-14,50,aubonne,G34,0,0.0
"('aubonne', '14.05.2022')",Aubonne,Grand lac,4,2022-05-14,50,aubonne,G100,0,0.0
"('aubonne', '14.05.2022')",Aubonne,Grand lac,4,2022-05-14,50,aubonne,G12,0,0.0
"('aubonne', '14.05.2022')",Aubonne,Grand lac,4,2022-05-14,50,aubonne,G144,0,0.0
"('aubonne', '14.05.2022')",Aubonne,Grand lac,4,2022-05-14,50,aubonne,G18,0,0.0
"('aubonne', '14.05.2022')",Aubonne,Grand lac,4,2022-05-14,50,aubonne,G33,0,0.0
"('aubonne', '14.05.2022')",Aubonne,Grand lac,4,2022-05-14,50,aubonne,G67,0,0.0
"('aubonne', '14.05.2022')",Aubonne,Grand lac,4,2022-05-14,50,aubonne,G90,0,0.0
"('aubonne', '14.05.2022')",Aubonne,Grand lac,4,2022-05-14,50,aubonne,G937,0,0.0
"('aubonne', '14.05.2022')",Aubonne,Grand lac,4,2022-05-14,50,aubonne,G133,0,0.0
"('aubonne', '14.05.2022')",Aubonne,Grand lac,4,2022-05-14,50,aubonne,G28,0,0.0
"('aubonne', '14.05.2022')",Aubonne,Grand lac,4,2022-05-14,50,aubonne,G39,0,0.0
"('aubonne', '14.05.2022')",Aubonne,Grand lac,4,2022-05-14,50,aubonne,G4,0,0.0
"('aubonne', '14.05.2022')",Aubonne,Grand lac,4,2022-05-14,50,aubonne,G54,0,0.0
"('aubonne', '14.05.2022')",Aubonne,Grand lac,4,2022-05-14,50,aubonne,G7,0,0.0
"('aubonne', '14.05.2022')",Aubonne,Grand lac,4,2022-05-14,50,aubonne,G155,0,0.0
"('aubonne', '14.05.2022')",Aubonne,Grand lac,4,2022-05-14,50,aubonne,G127,0,0.0
"('aubonne', '14.05.2022')",Aubonne,Grand lac,4,2022-05-14,50,aubonne,G129,0,0.0
"('aubonne', '14.05.2022')",Aubonne,Grand lac,4,2022-05-14,50,aubonne,G136,0,0.0
"('aubonne', '14.05.2022')",Aubonne,Grand lac,4,2022-05-14,50,aubonne,G80,0,0.0
"('aubonne', '14.05.2022')",Aubonne,Grand lac,4,2022-05-14,50,aubonne,G102,0,0.0
"('aubonne', '14.05.2022')",Aubonne,Grand lac,4,2022-05-14,50,aubonne,G139,0,0.0
"('baby-plage', '02.09.2022')",Baby Plage,Petit lac,1,2022-09-02,81,baby-plage,G113,0,0.0
"('baby-plage', '02.09.2022')",Baby Plage,Petit lac,1,2022-09-02,81,baby-plage,G114,0,0.0
"('baby-plage', '02.09.2022')",Baby Plage,Petit lac,1,2022-09-02,81,baby-plage,G148,0,0.0
"('baby-plage', '02.09.2022')",Baby Plage,Petit lac,1,2022-09-02,81,baby-plage,G31,0,0.0
"('baby-plage', '02.09.2022')",Baby Plage,Petit lac,1,2022-09-02,81,baby-plage,G70,0,0.0
"('baby-plage', '02.09.2022')",Baby Plage,Petit lac,1,2022-09-02,81,baby-plage,G905,0,0.0
"('baby-plage', '02.09.2022')",Baby Plage,Petit lac,1,2022-09-02,81,baby-plage,G914,0,0.0
"('baby-plage', '02.09.2022')",Baby Plage,Petit lac,1,2022-09-02,81,baby-plage,G931,0,0.0
"('baby-plage', '02.09.2022')",Baby Plage,Petit lac,1,2022-09-02,81,baby-plage,G932,0,0.0
"('baby-plage', '02.09.2022')",Baby Plage,Petit lac,1,2022-09-02,81,baby-plage,G97,0,0.0
"('baby-plage', '02.09.2022')",Baby Plage,Petit lac,1,2022-09-02,81,baby-plage,G159,0,0.0
"('baby-plage', '02.09.2022')",Baby Plage,Petit lac,1,2022-09-02,81,baby-plage,G25,0,0.0
"('baby-plage', '02.09.2022')",Baby Plage,Petit lac,1,2022-09-02,81,baby-plage,G89,0,0.0
"('baby-plage', '02.09.2022')",Baby Plage,Petit lac,1,2022-09-02,81,baby-plage,G125,0,0.0
"('baby-plage', '02.09.2022')",Baby Plage,Petit lac,1,2022-09-02,81,baby-plage,G135,0,0.0
"('baby-plage', '02.09.2022')",Baby Plage,Petit lac,1,2022-09-02,81,baby-plage,G29,0,0.0
"('baby-plage', '02.09.2022')",Baby Plage,Petit lac,1,2022-09-02,81,baby-plage,G99,0,0.0
"('baby-plage', '02.09.2022')",Baby Plage,Petit lac,1,2022-09-02,81,baby-plage,G132,0,0.0
"('baby-plage', '02.09.2022')",Baby Plage,Petit lac,1,2022-09-02,81,baby-plage,G53,0,0.0
"('baby-plage', '02.09.2022')",Baby Plage,Petit lac,1,2022-09-02,81,baby-plage,G73,0,0.0
"('baby-plage', '02.09.2022')",Baby Plage,Petit lac,1,2022-09-02,81,baby-plage,G926,0,0.0
"('baby-plage', '02.09.2022')",Baby Plage,Petit lac,1,2022-09-02,81,baby-plage,G126,0,0.0
"('baby-plage', '02.09.2022')",Baby Plage,Petit lac,1,2022-09-02,81,baby-plage,G128,0,0.0
"('baby-plage', '02.09.2022')",Baby Plage,Petit lac,1,2022-09-02,81,baby-plage,G194,0,0.0
"('baby-plage', '02.09.2022')",Baby Plage,Petit lac,1,2022-09-02,81,baby-plage,G26,0,0.0
"('baby-plage', '02.09.2022')",Baby Plage,Petit lac,1,2022-09-02,81,baby-plage,G48,0,0.0
"('baby-plage', '02.09.2022')",Baby Plage,Petit lac,1,2022-09-02,81,baby-plage,G901,0,0.0
"('baby-plage', '02.09.2022')",Baby Plage,Petit lac,1,2022-09-02,81,baby-plage,G929,0,0.0
"('baby-plage', '02.09.2022')",Baby Plage,Petit lac,1,2022-09-02,81,baby-plage,G101,0,0.0
"('baby-plage', '02.09.2022')",Baby Plage,Petit lac,1,2022-09-02,81,baby-plage,G34,0,0.0
"('baby-plage', '02.09.2022')",Baby Plage,Petit lac,1,2022-09-02,81,baby-plage,G100,0,0.0
"('baby-plage', '02.09.2022')",Baby Plage,Petit lac,1,2022-09-02,81,baby-plage,G12,0,0.0
"('baby-plage', '02.09.2022')",Baby Plage,Petit lac,1,2022-09-02,81,baby-plage,G144,0,0.0
"('baby-plage', '02.09.2022')",Baby Plage,Petit lac,1,2022-09-02,81,baby-plage,G18,0,0.0
"('baby-plage', '02.09.2022')",Baby Plage,Petit lac,1,2022-09-02,81,baby-plage,G33,0,0.0
"('baby-plage', '02.09.2022')",Baby Plage,Petit lac,1,2022-09-02,81,baby-plage,G67,0,0.0
"('baby-plage', '02.09.2022')",Baby Plage,Petit lac,1,2022-09-02,81,baby-plage,G90,0,0.0
"('baby-plage', '02.09.2022')",Baby Plage,Petit lac,1,2022-09-02,81,baby-plage,G937,0,0.0
"('baby-plage', '02.09.2022')",Baby Plage,Petit lac,1,2022-09-02,81,baby-plage,G133,0,0.0
"('baby-plage', '02.09.2022')",Baby Plage,Petit lac,1,2022-09-02,81,baby-plage,G28,0,0.0
"('baby-plage', '02.09.2022')",Baby Plage,Petit lac,1,2022-09-02,81,baby-plage,G39,0,0.0
"('baby-plage', '02.09.2022')",Baby Plage,Petit lac,1,2022-09-02,81,baby-plage,G4,0,0.0
"('baby-plage', '02.09.2022')",Baby Plage,Petit lac,1,2022-09-02,81,baby-plage,G54,0,0.0
"('baby-plage', '02.09.2022')",Baby Plage,Petit lac,1,2022-09-02,81,baby-plage,G7,0,0.0
"('baby-plage', '02.09.2022')",Baby Plage,Petit lac,1,2022-09-02,81,baby-plage,G155,0,0.0
"('baby-plage', '02.09.2022')",Baby Plage,Petit lac,1,2022-09-02,81,baby-plage,G127,0,0.0
"('baby-plage', '02.09.2022')",Baby Plage,Petit lac,1,2022-09-02,81,baby-plage,G129,0,0.0
"('baby-plage', '02.09.2022')",Baby Plage,Petit lac,1,2022-09-02,81,baby-plage,G136,0,0.0
"('baby-plage', '02.09.2022')",Baby Plage,Petit lac,1,2022-09-02,81,baby-plage,G80,0,0.0
"('baby-plage', '02.09.2022')",Baby Plage,Petit lac,1,2022-09-02,81,baby-plage,G102,0,0.0
"('baby-plage', '02.09.2022')",Baby Plage,Petit lac,1,2022-09-02,81,baby-plage,G139,0,0.0
"('baby-plage', '15.10.2022')",Baby Plage,Petit lac,1,2022-10-15,81,baby-plage,G148,0,0.0
"('baby-plage', '15.10.2022')",Baby Plage,Petit lac,1,2022-10-15,81,baby-plage,G21,0,0.0
"('baby-plage', '15.10.2022')",Baby Plage,Petit lac,1,2022-10-15,81,baby-plage,G23,0,0.0
"('baby-plage', '15.10.2022')",Baby Plage,Petit lac,1,2022-10-15,81,baby-plage,G24,0,0.0
"('baby-plage', '15.10.2022')",Baby Plage,Petit lac,1,2022-10-15,81,baby-plage,G31,0,0.0
"('baby-plage', '15.10.2022')",Baby Plage,Petit lac,1,2022-10-15,81,baby-plage,G35,0,0.0
"('baby-plage', '15.10.2022')",Baby Plage,Petit lac,1,2022-10-15,81,baby-plage,G66,0,0.0
"('baby-plage', '15.10.2022')",Baby Plage,Petit lac,1,2022-10-15,81,baby-plage,G70,0,0.0
"('baby-plage', '15.10.2022')",Baby Plage,Petit lac,1,2022-10-15,81,baby-plage,G905,0,0.0
"('baby-plage', '15.10.2022')",Baby Plage,Petit lac,1,2022-10-15,81,baby-plage,G914,0,0.0
"('baby-plage', '15.10.2022')",Baby Plage,Petit lac,1,2022-10-15,81,baby-plage,G922,0,0.0
"('baby-plage', '15.10.2022')",Baby Plage,Petit lac,1,2022-10-15,81,baby-plage,G931,0,0.0
"('baby-plage', '15.10.2022')",Baby Plage,Petit lac,1,2022-10-15,81,baby-plage,G932,0,0.0
"('baby-plage', '15.10.2022')",Baby Plage,Petit lac,1,2022-10-15,81,baby-plage,G95,0,0.0
"('baby-plage', '15.10.2022')",Baby Plage,Petit lac,1,2022-10-15,81,baby-plage,G97,0,0.0
"('baby-plage', '15.10.2022')",Baby Plage,Petit lac,1,2022-10-15,81,baby-plage,G159,0,0.0
"('baby-plage', '15.10.2022')",Baby Plage,Petit lac,1,2022-10-15,81,baby-plage,G10,0,0.0
"('baby-plage', '15.10.2022')",Baby Plage,Petit lac,1,2022-10-15,81,baby-plage,G103,0,0.0
"('baby-plage', '15.10.2022')",Baby Plage,Petit lac,1,2022-10-15,81,baby-plage,G25,0,0.0
"('baby-plage', '15.10.2022')",Baby Plage,Petit lac,1,2022-10-15,81,baby-plage,G135,0,0.0
"('baby-plage', '15.10.2022')",Baby Plage,Petit lac,1,2022-10-15,81,baby-plage,G145,0,0.0
"('baby-plage', '15.10.2022')",Baby Plage,Petit lac,1,2022-10-15,81,baby-plage,G29,0,0.0
"('baby-plage', '15.10.2022')",Baby Plage,Petit lac,1,2022-10-15,81,baby-plage,G99,0,0.0
"('baby-plage', '15.10.2022')",Baby Plage,Petit lac,1,2022-10-15,81,baby-plage,G132,0,0.0
"('baby-plage', '15.10.2022')",Baby Plage,Petit lac,1,2022-10-15,81,baby-plage,G53,0,0.0
"('baby-plage', '15.10.2022')",Baby Plage,Petit lac,1,2022-10-15,81,baby-plage,G137,0,0.0
"('baby-plage', '15.10.2022')",Baby Plage,Petit lac,1,2022-10-15,81,baby-plage,G126,0,0.0
"('baby-plage', '15.10.2022')",Baby Plage,Petit lac,1,2022-10-15,81,baby-plage,G128,0,0.0
"('baby-plage', '15.10.2022')",Baby Plage,Petit lac,1,2022-10-15,81,baby-plage,G194,0,0.0
"('baby-plage', '15.10.2022')",Baby Plage,Petit lac,1,2022-10-15,81,baby-plage,G26,0,0.0
"('baby-plage', '15.10.2022')",Baby Plage,Petit lac,1,2022-10-15,81,baby-plage,G48,0,0.0
"('baby-plage', '15.10.2022')",Baby Plage,Petit lac,1,2022-10-15,81,baby-plage,G901,0,0.0
"('baby-plage', '15.10.2022')",Baby Plage,Petit lac,1,2022-10-15,81,baby-plage,G929,0,0.0
"('baby-plage', '15.10.2022')",Baby Plage,Petit lac,1,2022-10-15,81,baby-plage,G101,0,0.0
"('baby-plage', '15.10.2022')",Baby Plage,Petit lac,1,2022-10-15,81,baby-plage,G34,0,0.0
"('baby-plage', '15.10.2022')",Baby Plage,Petit lac,1,2022-10-15,81,baby-plage,G100,0,0.0
"('baby-plage', '15.10.2022')",Baby Plage,Petit lac,1,2022-10-15,81,baby-plage,G12,0,0.0
"('baby-plage', '15.10.2022')",Baby Plage,Petit lac,1,2022-10-15,81,baby-plage,G144,0,0.0
"('baby-plage', '15.10.2022')",Baby Plage,Petit lac,1,2022-10-15,81,baby-plage,G18,0,0.0
"('baby-plage', '15.10.2022')",Baby Plage,Petit lac,1,2022-10-15,81,baby-plage,G33,0,0.0
"('baby-plage', '15.10.2022')",Baby Plage,Petit lac,1,2022-10-15,81,baby-plage,G67,0,0.0
"('baby-plage', '15.10.2022')",Baby Plage,Petit lac,1,2022-10-15,81,baby-plage,G90,0,0.0
"('baby-plage', '15.10.2022')",Baby Plage,Petit lac,1,2022-10-15,81,baby-plage,G937,0,0.0
"('baby-plage', '15.10.2022')",Baby Plage,Petit lac,1,2022-10-15,81,baby-plage,G133,0,0.0
"('baby-plage', '15.10.2022')",Baby Plage,Petit lac,1,2022-10-15,81,baby-plage,G28,0,0.0
"('baby-plage', '15.10.2022')",Baby Plage,Petit lac,1,2022-10-15,81,baby-plage,G39,0,0.0
"('baby-plage', '15.10.2022')",Baby Plage,Petit lac,1,2022-10-15,81,baby-plage,G4,0,0.0
"('baby-plage', '15.10.2022')",Baby Plage,Petit lac,1,2022-10-15,81,baby-plage,G54,0,0.0
"('baby-plage', '15.10.2022')",Baby Plage,Petit lac,1,2022-10-15,81,baby-plage,G7,0,0.0
"('baby-plage', '15.10.2022')",Baby Plage,Petit lac,1,2022-10-15,81,baby-plage,G155,0,0.0
"('baby-plage', '15.10.2022')",Baby Plage,Petit lac,1,2022-10-15,81,baby-plage,G127,0,0.0
"('baby-plage', '15.10.2022')",Baby Plage,Petit lac,1,2022-10-15,81,baby-plage,G129,0,0.0
"('baby-plage', '15.10.2022')",Baby Plage,Petit lac,1,2022-10-15,81,baby-plage,G136,0,0.0
"('baby-plage', '15.10.2022')",Baby Plage,Petit lac,1,2022-10-15,81,baby-plage,G80,0,0.0
"('baby-plage', '15.10.2022')",Baby Plage,Petit lac,1,2022-10-15,81,baby-plage,G102,0,0.0
"('baby-plage', '15.10.2022')",Baby Plage,Petit lac,1,2022-10-15,81,baby-plage,G139,0,0.0
"('baby-plage', '22.01.2022')",Baby Plage,Petit lac,1,2022-01-22,81,baby-plage,G113,0,0.0
"('baby-plage', '22.01.2022')",Baby Plage,Petit lac,1,2022-01-22,81,baby-plage,G114,0,0.0
"('baby-plage', '22.01.2022')",Baby Plage,Petit lac,1,2022-01-22,81,baby-plage,G131,0,0.0
"('baby-plage', '22.01.2022')",Baby Plage,Petit lac,1,2022-01-22,81,baby-plage,G148,0,0.0
"('baby-plage', '22.01.2022')",Baby Plage,Petit lac,1,2022-01-22,81,baby-plage,G31,0,0.0
"('baby-plage', '22.01.2022')",Baby Plage,Petit lac,1,2022-01-22,81,baby-plage,G66,0,0.0
"('baby-plage', '22.01.2022')",Baby Plage,Petit lac,1,2022-01-22,81,baby-plage,G914,0,0.0
"('baby-plage', '22.01.2022')",Baby Plage,Petit lac,1,2022-01-22,81,baby-plage,G922,0,0.0
"('baby-plage', '22.01.2022')",Baby Plage,Petit lac,1,2022-01-22,81,baby-plage,G931,0,0.0
"('baby-plage', '22.01.2022')",Baby Plage,Petit lac,1,2022-01-22,81,baby-plage,G932,0,0.0
"('baby-plage', '22.01.2022')",Baby Plage,Petit lac,1,2022-01-22,81,baby-plage,G97,0,0.0
"('baby-plage', '22.01.2022')",Baby Plage,Petit lac,1,2022-01-22,81,baby-plage,G159,0,0.0
"('baby-plage', '22.01.2022')",Baby Plage,Petit lac,1,2022-01-22,81,baby-plage,G10,0,0.0
"('baby-plage', '22.01.2022')",Baby Plage,Petit lac,1,2022-01-22,81,baby-plage,G103,0,0.0
"('baby-plage', '22.01.2022')",Baby Plage,Petit lac,1,2022-01-22,81,baby-plage,G2,0,0.0
"('baby-plage', '22.01.2022')",Baby Plage,Petit lac,1,2022-01-22,81,baby-plage,G25,0,0.0
"('baby-plage', '22.01.2022')",Baby Plage,Petit lac,1,2022-01-22,81,baby-plage,G74,0,0.0
"('baby-plage', '22.01.2022')",Baby Plage,Petit lac,1,2022-01-22,81,baby-plage,G135,0,0.0
"('baby-plage', '22.01.2022')",Baby Plage,Petit lac,1,2022-01-22,81,baby-plage,G145,0,0.0
"('baby-plage', '22.01.2022')",Baby Plage,Petit lac,1,2022-01-22,81,baby-plage,G29,0,0.0
"('baby-plage', '22.01.2022')",Baby Plage,Petit lac,1,2022-01-22,81,baby-plage,G99,0,0.0
"('baby-plage', '22.01.2022')",Baby Plage,Petit lac,1,2022-01-22,81,baby-plage,G132,0,0.0
"('baby-plage', '22.01.2022')",Baby Plage,Petit lac,1,2022-01-22,81,baby-plage,G53,0,0.0
"('baby-plage', '22.01.2022')",Baby Plage,Petit lac,1,2022-01-22,81,baby-plage,G165,0,0.0
"('baby-plage', '22.01.2022')",Baby Plage,Petit lac,1,2022-01-22,81,baby-plage,G137,0,0.0
"('baby-plage', '22.01.2022')",Baby Plage,Petit lac,1,2022-01-22,81,baby-plage,G73,0,0.0
"('baby-plage', '22.01.2022')",Baby Plage,Petit lac,1,2022-01-22,81,baby-plage,G926,0,0.0
"('baby-plage', '22.01.2022')",Baby Plage,Petit lac,1,2022-01-22,81,baby-plage,G101,0,0.0
"('baby-plage', '22.01.2022')",Baby Plage,Petit lac,1,2022-01-22,81,baby-plage,G34,0,0.0
"('baby-plage', '22.01.2022')",Baby Plage,Petit lac,1,2022-01-22,81,baby-plage,G100,0,0.0
"('baby-plage', '22.01.2022')",Baby Plage,Petit lac,1,2022-01-22,81,baby-plage,G12,0,0.0
"('baby-plage', '22.01.2022')",Baby Plage,Petit lac,1,2022-01-22,81,baby-plage,G144,0,0.0
"('baby-plage', '22.01.2022')",Baby Plage,Petit lac,1,2022-01-22,81,baby-plage,G18,0,0.0
"('baby-plage', '22.01.2022')",Baby Plage,Petit lac,1,2022-01-22,81,baby-plage,G33,0,0.0
"('baby-plage', '22.01.2022')",Baby Plage,Petit lac,1,2022-01-22,81,baby-plage,G67,0,0.0
"('baby-plage', '22.01.2022')",Baby Plage,Petit lac,1,2022-01-22,81,baby-plage,G90,0,0.0
"('baby-plage', '22.01.2022')",Baby Plage,Petit lac,1,2022-01-22,81,baby-plage,G937,0,0.0
"('baby-plage', '22.01.2022')",Baby Plage,Petit lac,1,2022-01-22,81,baby-plage,G133,0,0.0
"('baby-plage', '22.01.2022')",Baby Plage,Petit lac,1,2022-01-22,81,baby-plage,G28,0,0.0
"('baby-plage', '22.01.2022')",Baby Plage,Petit lac,1,2022-01-22,81,baby-plage,G39,0,0.0
"('baby-plage', '22.01.2022')",Baby Plage,Petit lac,1,2022-01-22,81,baby-plage,G4,0,0.0
"('baby-plage', '22.01.2022')",Baby Plage,Petit lac,1,2022-01-22,81,baby-plage,G54,0,0.0
"('baby-plage', '22.01.2022')",Baby Plage,Petit lac,1,2022-01-22,81,baby-plage,G7,0,0.0
"('baby-plage', '22.01.2022')",Baby Plage,Petit lac,1,2022-01-22,81,baby-plage,G155,0,0.0
"('baby-plage', '22.01.2022')",Baby Plage,Petit lac,1,2022-01-22,81,baby-plage,G127,0,0.0
"('baby-plage', '22.01.2022')",Baby Plage,Petit lac,1,2022-01-22,81,baby-plage,G129,0,0.0
"('baby-plage', '22.01.2022')",Baby Plage,Petit lac,1,2022-01-22,81,baby-plage,G136,0,0.0
"('baby-plage', '22.01.2022')",Baby Plage,Petit lac,1,2022-01-22,81,baby-plage,G80,0,0.0
"('baby-plage', '22.01.2022')",Baby Plage,Petit lac,1,2022-01-22,81,baby-plage,G102,0,0.0
"('baby-plage', '22.01.2022')",Baby Plage,Petit lac,1,2022-01-22,81,baby-plage,G139,0,0.0
"('baby-plage', '23.04.2022')",Baby Plage,Petit lac,1,2022-04-23,81,baby-plage,G114,0,0.0
"('baby-plage', '23.04.2022')",Baby Plage,Petit lac,1,2022-04-23,81,baby-plage,G148,0,0.0
"('baby-plage', '23.04.2022')",Baby Plage,Petit lac,1,2022-04-23,81,baby-plage,G31,0,0.0
"('baby-plage', '23.04.2022')",Baby Plage,Petit lac,1,2022-04-23,81,baby-plage,G35,0,0.0
"('baby-plage', '23.04.2022')",Baby Plage,Petit lac,1,2022-04-23,81,baby-plage,G66,0,0.0
"('baby-plage', '23.04.2022')",Baby Plage,Petit lac,1,2022-04-23,81,baby-plage,G70,0,0.0
"('baby-plage', '23.04.2022')",Baby Plage,Petit lac,1,2022-04-23,81,baby-plage,G81,0,0.0
"('baby-plage', '23.04.2022')",Baby Plage,Petit lac,1,2022-04-23,81,baby-plage,G82,0,0.0
"('baby-plage', '23.04.2022')",Baby Plage,Petit lac,1,2022-04-23,81,baby-plage,G914,0,0.0
"('baby-plage', '23.04.2022')",Baby Plage,Petit lac,1,2022-04-23,81,baby-plage,G922,0,0.0
"('baby-plage', '23.04.2022')",Baby Plage,Petit lac,1,2022-04-23,81,baby-plage,G931,0,0.0
"('baby-plage', '23.04.2022')",Baby Plage,Petit lac,1,2022-04-23,81,baby-plage,G932,0,0.0
"('baby-plage', '23.04.2022')",Baby Plage,Petit lac,1,2022-04-23,81,baby-plage,G95,0,0.0
"('baby-plage', '23.04.2022')",Baby Plage,Petit lac,1,2022-04-23,81,baby-plage,G10,0,0.0
"('baby-plage', '23.04.2022')",Baby Plage,Petit lac,1,2022-04-23,81,baby-plage,G103,0,0.0
"('baby-plage', '23.04.2022')",Baby Plage,Petit lac,1,2022-04-23,81,baby-plage,G117,0,0.0
"('baby-plage', '23.04.2022')",Baby Plage,Petit lac,1,2022-04-23,81,baby-plage,G25,0,0.0
"('baby-plage', '23.04.2022')",Baby Plage,Petit lac,1,2022-04-23,81,baby-plage,G74,0,0.0
"('baby-plage', '23.04.2022')",Baby Plage,Petit lac,1,2022-04-23,81,baby-plage,G89,0,0.0
"('baby-plage', '23.04.2022')",Baby Plage,Petit lac,1,2022-04-23,81,baby-plage,G125,0,0.0
"('baby-plage', '23.04.2022')",Baby Plage,Petit lac,1,2022-04-23,81,baby-plage,G29,0,0.0
"('baby-plage', '23.04.2022')",Baby Plage,Petit lac,1,2022-04-23,81,baby-plage,G32,0,0.0
"('baby-plage', '23.04.2022')",Baby Plage,Petit lac,1,2022-04-23,81,baby-plage,G50,0,0.0
"('baby-plage', '23.04.2022')",Baby Plage,Petit lac,1,2022-04-23,81,baby-plage,G99,0,0.0
"('baby-plage', '23.04.2022')",Baby Plage,Petit lac,1,2022-04-23,81,baby-plage,G132,0,0.0
"('baby-plage', '23.04.2022')",Baby Plage,Petit lac,1,2022-04-23,81,baby-plage,G53,0,0.0
"('baby-plage', '23.04.2022')",Baby Plage,Petit lac,1,2022-04-23,81,baby-plage,G73,0,0.0
"('baby-plage', '23.04.2022')",Baby Plage,Petit lac,1,2022-04-23,81,baby-plage,G926,0,0.0
"('baby-plage', '23.04.2022')",Baby Plage,Petit lac,1,2022-04-23,81,baby-plage,G126,0,0.0
"('baby-plage', '23.04.2022')",Baby Plage,Petit lac,1,2022-04-23,81,baby-plage,G128,0,0.0
"('baby-plage', '23.04.2022')",Baby Plage,Petit lac,1,2022-04-23,81,baby-plage,G26,0,0.0
"('baby-plage', '23.04.2022')",Baby Plage,Petit lac,1,2022-04-23,81,baby-plage,G48,0,0.0
"('baby-plage', '23.04.2022')",Baby Plage,Petit lac,1,2022-04-23,81,baby-plage,G929,0,0.0
"('baby-plage', '23.04.2022')",Baby Plage,Petit lac,1,2022-04-23,81,baby-plage,G101,0,0.0
"('baby-plage', '23.04.2022')",Baby Plage,Petit lac,1,2022-04-23,81,baby-plage,G34,0,0.0
"('baby-plage', '23.04.2022')",Baby Plage,Petit lac,1,2022-04-23,81,baby-plage,G100,0,0.0
"('baby-plage', '23.04.2022')",Baby Plage,Petit lac,1,2022-04-23,81,baby-plage,G12,0,0.0
"('baby-plage', '23.04.2022')",Baby Plage,Petit lac,1,2022-04-23,81,baby-plage,G144,0,0.0
"('baby-plage', '23.04.2022')",Baby Plage,Petit lac,1,2022-04-23,81,baby-plage,G18,0,0.0
"('baby-plage', '23.04.2022')",Baby Plage,Petit lac,1,2022-04-23,81,baby-plage,G33,0,0.0
"('baby-plage', '23.04.2022')",Baby Plage,Petit lac,1,2022-04-23,81,baby-plage,G67,0,0.0
"('baby-plage', '23.04.2022')",Baby Plage,Petit lac,1,2022-04-23,81,baby-plage,G90,0,0.0
"('baby-plage', '23.04.2022')",Baby Plage,Petit lac,1,2022-04-23,81,baby-plage,G937,0,0.0
"('baby-plage', '23.04.2022')",Baby Plage,Petit lac,1,2022-04-23,81,baby-plage,G133,0,0.0
"('baby-plage', '23.04.2022')",Baby Plage,Petit lac,1,2022-04-23,81,baby-plage,G28,0,0.0
"('baby-plage', '23.04.2022')",Baby Plage,Petit lac,1,2022-04-23,81,baby-plage,G39,0,0.0
"('baby-plage', '23.04.2022')",Baby Plage,Petit lac,1,2022-04-23,81,baby-plage,G4,0,0.0
"('baby-plage', '23.04.2022')",Baby Plage,Petit lac,1,2022-04-23,81,baby-plage,G54,0,0.0
"('baby-plage', '23.04.2022')",Baby Plage,Petit lac,1,2022-04-23,81,baby-plage,G7,0,0.0
"('baby-plage', '23.04.2022')",Baby Plage,Petit lac,1,2022-04-23,81,baby-plage,G155,0,0.0
"('baby-plage', '23.04.2022')",Baby Plage,Petit lac,1,2022-04-23,81,baby-plage,G127,0,0.0
"('baby-plage', '23.04.2022')",Baby Plage,Petit lac,1,2022-04-23,81,baby-plage,G129,0,0.0
"('baby-plage', '23.04.2022')",Baby Plage,Petit lac,1,2022-04-23,81,baby-plage,G136,0,0.0
"('baby-plage', '23.04.2022')",Baby Plage,Petit lac,1,2022-04-23,81,baby-plage,G80,0,0.0
"('baby-plage', '23.04.2022')",Baby Plage,Petit lac,1,2022-04-23,81,baby-plage,G102,0,0.0
"('baby-plage', '23.04.2022')",Baby Plage,Petit lac,1,2022-04-23,81,baby-plage,G139,0,0.0
"('bouveret', '03.09.2022')",Bouveret,Haut lac,1,2022-09-03,116,bouveret,G113,0,0.0
"('bouveret', '03.09.2022')",Bouveret,Haut lac,1,2022-09-03,116,bouveret,G114,0,0.0
"('bouveret', '03.09.2022')",Bouveret,Haut lac,1,2022-09-03,116,bouveret,G131,0,0.0
"('bouveret', '03.09.2022')",Bouveret,Haut lac,1,2022-09-03,116,bouveret,G148,0,0.0
"('bouveret', '03.09.2022')",Bouveret,Haut lac,1,2022-09-03,116,bouveret,G35,0,0.0
"('bouveret', '03.09.2022')",Bouveret,Haut lac,1,2022-09-03,116,bouveret,G914,0,0.0
"('bouveret', '03.09.2022')",Bouveret,Haut lac,1,2022-09-03,116,bouveret,G922,0,0.0
"('bouveret', '03.09.2022')",Bouveret,Haut lac,1,2022-09-03,116,bouveret,G931,0,0.0
"('bouveret', '03.09.2022')",Bouveret,Haut lac,1,2022-09-03,116,bouveret,G97,0,0.0
"('bouveret', '03.09.2022')",Bouveret,Haut lac,1,2022-09-03,116,bouveret,G159,0,0.0
"('bouveret', '03.09.2022')",Bouveret,Haut lac,1,2022-09-03,116,bouveret,G10,0,0.0
"('bouveret', '03.09.2022')",Bouveret,Haut lac,1,2022-09-03,116,bouveret,G2,0,0.0
"('bouveret', '03.09.2022')",Bouveret,Haut lac,1,2022-09-03,116,bouveret,G25,0,0.0
"('bouveret', '03.09.2022')",Bouveret,Haut lac,1,2022-09-03,116,bouveret,G135,0,0.0
"('bouveret', '03.09.2022')",Bouveret,Haut lac,1,2022-09-03,116,bouveret,G145,0,0.0
"('bouveret', '03.09.2022')",Bouveret,Haut lac,1,2022-09-03,116,bouveret,G29,0,0.0
"('bouveret', '03.09.2022')",Bouveret,Haut lac,1,2022-09-03,116,bouveret,G99,0,0.0
"('bouveret', '03.09.2022')",Bouveret,Haut lac,1,2022-09-03,116,bouveret,G132,0,0.0
"('bouveret', '03.09.2022')",Bouveret,Haut lac,1,2022-09-03,116,bouveret,G53,0,0.0
"('bouveret', '03.09.2022')",Bouveret,Haut lac,1,2022-09-03,116,bouveret,G165,0,0.0
"('bouveret', '03.09.2022')",Bouveret,Haut lac,1,2022-09-03,116,bouveret,G137,0,0.0
"('bouveret', '03.09.2022')",Bouveret,Haut lac,1,2022-09-03,116,bouveret,G73,0,0.0
"('bouveret', '03.09.2022')",Bouveret,Haut lac,1,2022-09-03,116,bouveret,G926,0,0.0
"('bouveret', '03.09.2022')",Bouveret,Haut lac,1,2022-09-03,116,bouveret,G126,0,0.0
"('bouveret', '03.09.2022')",Bouveret,Haut lac,1,2022-09-03,116,bouveret,G128,0,0.0
"('bouveret', '03.09.2022')",Bouveret,Haut lac,1,2022-09-03,116,bouveret,G26,0,0.0
"('bouveret', '03.09.2022')",Bouveret,Haut lac,1,2022-09-03,116,bouveret,G48,0,0.0
"('bouveret', '03.09.2022')",Bouveret,Haut lac,1,2022-09-03,116,bouveret,G901,0,0.0
"('bouveret', '03.09.2022')",Bouveret,Haut lac,1,2022-09-03,116,bouveret,G929,0,0.0
"('bouveret', '03.09.2022')",Bouveret,Haut lac,1,2022-09-03,116,bouveret,G101,0,0.0
"('bouveret', '03.09.2022')",Bouveret,Haut lac,1,2022-09-03,116,bouveret,G34,0,0.0
"('bouveret', '03.09.2022')",Bouveret,Haut lac,1,2022-09-03,116,bouveret,G100,0,0.0
"('bouveret', '03.09.2022')",Bouveret,Haut lac,1,2022-09-03,116,bouveret,G12,0,0.0
"('bouveret', '03.09.2022')",Bouveret,Haut lac,1,2022-09-03,116,bouveret,G144,0,0.0
"('bouveret', '03.09.2022')",Bouveret,Haut lac,1,2022-09-03,116,bouveret,G18,0,0.0
"('bouveret', '03.09.2022')",Bouveret,Haut lac,1,2022-09-03,116,bouveret,G33,0,0.0
"('bouveret', '03.09.2022')",Bouveret,Haut lac,1,2022-09-03,116,bouveret,G67,0,0.0
"('bouveret', '03.09.2022')",Bouveret,Haut lac,1,2022-09-03,116,bouveret,G90,0,0.0
"('bouveret', '03.09.2022')",Bouveret,Haut lac,1,2022-09-03,116,bouveret,G937,0,0.0
"('bouveret', '03.09.2022')",Bouveret,Haut lac,1,2022-09-03,116,bouveret,G133,0,0.0
"('bouveret', '03.09.2022')",Bouveret,Haut lac,1,2022-09-03,116,bouveret,G28,0,0.0
"('bouveret', '03.09.2022')",Bouveret,Haut lac,1,2022-09-03,116,bouveret,G39,0,0.0
"('bouveret', '03.09.2022')",Bouveret,Haut lac,1,2022-09-03,116,bouveret,G4,0,0.0
"('bouveret', '03.09.2022')",Bouveret,Haut lac,1,2022-09-03,116,bouveret,G54,0,0.0
"('bouveret', '03.09.2022')",Bouveret,Haut lac,1,2022-09-03,116,bouveret,G7,0,0.0
"('bouveret', '03.09.2022')",Bouveret,Haut lac,1,2022-09-03,116,bouveret,G155,0,0.0
"('bouveret', '03.09.2022')",Bouveret,Haut lac,1,2022-09-03,116,bouveret,G127,0,0.0
"('bouveret', '03.09.2022')",Bouveret,Haut lac,1,2022-09-03,116,bouveret,G129,0,0.0
"('bouveret', '03.09.2022')",Bouveret,Haut lac,1,2022-09-03,116,bouveret,G136,0,0.0
"('bouveret', '03.09.2022')",Bouveret,Haut lac,1,2022-09-03,116,bouveret,G80,0,0.0
"('bouveret', '03.09.2022')",Bouveret,Haut lac,1,2022-09-03,116,bouveret,G102,0,0.0
"('bouveret', '03.09.2022')",Bouveret,Haut lac,1,2022-09-03,116,bouveret,G139,0,0.0
"('bouveret', '05.11.2022')",Bouveret,Haut lac,1,2022-11-05,116,bouveret,G113,0,0.0
"('bouveret', '05.11.2022')",Bouveret,Haut lac,1,2022-11-05,116,bouveret,G114,0,0.0
"('bouveret', '05.11.2022')",Bouveret,Haut lac,1,2022-11-05,116,bouveret,G148,0,0.0
"('bouveret', '05.11.2022')",Bouveret,Haut lac,1,2022-11-05,116,bouveret,G211,0,0.0
"('bouveret', '05.11.2022')",Bouveret,Haut lac,1,2022-11-05,116,bouveret,G23,0,0.0
"('bouveret', '05.11.2022')",Bouveret,Haut lac,1,2022-11-05,116,bouveret,G66,0,0.0
"('bouveret', '05.11.2022')",Bouveret,Haut lac,1,2022-11-05,116,bouveret,G905,0,0.0
"('bouveret', '05.11.2022')",Bouveret,Haut lac,1,2022-11-05,116,bouveret,G914,0,0.0
"('bouveret', '05.11.2022')",Bouveret,Haut lac,1,2022-11-05,116,bouveret,G931,0,0.0
"('bouveret', '05.11.2022')",Bouveret,Haut lac,1,2022-11-05,116,bouveret,G95,0,0.0
"('bouveret', '05.11.2022')",Bouveret,Haut lac,1,2022-11-05,116,bouveret,G97,0,0.0
"('bouveret', '05.11.2022')",Bouveret,Haut lac,1,2022-11-05,116,bouveret,G159,0,0.0
"('bouveret', '05.11.2022')",Bouveret,Haut lac,1,2022-11-05,116,bouveret,G2,0,0.0
"('bouveret', '05.11.2022')",Bouveret,Haut lac,1,2022-11-05,116,bouveret,G25,0,0.0
"('bouveret', '05.11.2022')",Bouveret,Haut lac,1,2022-11-05,116,bouveret,G135,0,0.0
"('bouveret', '05.11.2022')",Bouveret,Haut lac,1,2022-11-05,116,bouveret,G145,0,0.0
"('bouveret', '05.11.2022')",Bouveret,Haut lac,1,2022-11-05,116,bouveret,G29,0,0.0
"('bouveret', '05.11.2022')",Bouveret,Haut lac,1,2022-11-05,116,bouveret,G99,0,0.0
"('bouveret', '05.11.2022')",Bouveret,Haut lac,1,2022-11-05,116,bouveret,G132,0,0.0
"('bouveret', '05.11.2022')",Bouveret,Haut lac,1,2022-11-05,116,bouveret,G53,0,0.0
"('bouveret', '05.11.2022')",Bouveret,Haut lac,1,2022-11-05,116,bouveret,G165,0,0.0
"('bouveret', '05.11.2022')",Bouveret,Haut lac,1,2022-11-05,116,bouveret,G137,0,0.0
"('bouveret', '05.11.2022')",Bouveret,Haut lac,1,2022-11-05,116,bouveret,G73,0,0.0
"('bouveret', '05.11.2022')",Bouveret,Haut lac,1,2022-11-05,116,bouveret,G926,0,0.0
"('bouveret', '05.11.2022')",Bouveret,Haut lac,1,2022-11-05,116,bouveret,G126,0,0.0
"('bouveret', '05.11.2022')",Bouveret,Haut lac,1,2022-11-05,116,bouveret,G128,0,0.0
"('bouveret', '05.11.2022')",Bouveret,Haut lac,1,2022-11-05,116,bouveret,G48,0,0.0
"('bouveret', '05.11.2022')",Bouveret,Haut lac,1,2022-11-05,116,bouveret,G929,0,0.0
"('bouveret', '05.11.2022')",Bouveret,Haut lac,1,2022-11-05,116,bouveret,G100,0,0.0
"('bouveret', '05.11.2022')",Bouveret,Haut lac,1,2022-11-05,116,bouveret,G12,0,0.0
"('bouveret', '05.11.2022')",Bouveret,Haut lac,1,2022-11-05,116,bouveret,G144,0,0.0
"('bouveret', '05.11.2022')",Bouveret,Haut lac,1,2022-11-05,116,bouveret,G18,0,0.0
"('bouveret', '05.11.2022')",Bouveret,Haut lac,1,2022-11-05,116,bouveret,G33,0,0.0
"('bouveret', '05.11.2022')",Bouveret,Haut lac,1,2022-11-05,116,bouveret,G67,0,0.0
"('bouveret', '05.11.2022')",Bouveret,Haut lac,1,2022-11-05,116,bouveret,G90,0,0.0
"('bouveret', '05.11.2022')",Bouveret,Haut lac,1,2022-11-05,116,bouveret,G937,0,0.0
"('bouveret', '05.11.2022')",Bouveret,Haut lac,1,2022-11-05,116,bouveret,G133,0,0.0
"('bouveret', '05.11.2022')",Bouveret,Haut lac,1,2022-11-05,116,bouveret,G28,0,0.0
"('bouveret', '05.11.2022')",Bouveret,Haut lac,1,2022-11-05,116,bouveret,G39,0,0.0
"('bouveret', '05.11.2022')",Bouveret,Haut lac,1,2022-11-05,116,bouveret,G4,0,0.0
"('bouveret', '05.11.2022')",Bouveret,Haut lac,1,2022-11-05,116,bouveret,G54,0,0.0
"('bouveret', '05.11.2022')",Bouveret,Haut lac,1,2022-11-05,116,bouveret,G7,0,0.0
"('bouveret', '05.11.2022')",Bouveret,Haut lac,1,2022-11-05,116,bouveret,G155,0,0.0
"('bouveret', '05.11.2022')",Bouveret,Haut lac,1,2022-11-05,116,bouveret,G127,0,0.0
"('bouveret', '05.11.2022')",Bouveret,Haut lac,1,2022-11-05,116,bouveret,G129,0,0.0
"('bouveret', '05.11.2022')",Bouveret,Haut lac,1,2022-11-05,116,bouveret,G136,0,0.0
"('bouveret', '05.11.2022')",Bouveret,Haut lac,1,2022-11-05,116,bouveret,G80,0,0.0
"('bouveret', '05.11.2022')",Bouveret,Haut lac,1,2022-11-05,116,bouveret,G102,0,0.0
"('bouveret', '05.11.2022')",Bouveret,Haut lac,1,2022-11-05,116,bouveret,G139,0,0.0
"('bouveret', '15.01.2022')",Bouveret,Haut lac,1,2022-01-15,116,bouveret,G113,0,0.0
"('bouveret', '15.01.2022')",Bouveret,Haut lac,1,2022-01-15,116,bouveret,G114,0,0.0
"('bouveret', '15.01.2022')",Bouveret,Haut lac,1,2022-01-15,116,bouveret,G131,0,0.0
"('bouveret', '15.01.2022')",Bouveret,Haut lac,1,2022-01-15,116,bouveret,G148,0,0.0
"('bouveret', '15.01.2022')",Bouveret,Haut lac,1,2022-01-15,116,bouveret,G905,0,0.0
"('bouveret', '15.01.2022')",Bouveret,Haut lac,1,2022-01-15,116,bouveret,G914,0,0.0
"('bouveret', '15.01.2022')",Bouveret,Haut lac,1,2022-01-15,116,bouveret,G97,0,0.0
"('bouveret', '15.01.2022')",Bouveret,Haut lac,1,2022-01-15,116,bouveret,G2,0,0.0
"('bouveret', '15.01.2022')",Bouveret,Haut lac,1,2022-01-15,116,bouveret,G25,0,0.0
"('bouveret', '15.01.2022')",Bouveret,Haut lac,1,2022-01-15,116,bouveret,G135,0,0.0
"('bouveret', '15.01.2022')",Bouveret,Haut lac,1,2022-01-15,116,bouveret,G145,0,0.0
"('bouveret', '15.01.2022')",Bouveret,Haut lac,1,2022-01-15,116,bouveret,G29,0,0.0
"('bouveret', '15.01.2022')",Bouveret,Haut lac,1,2022-01-15,116,bouveret,G99,0,0.0
"('bouveret', '15.01.2022')",Bouveret,Haut lac,1,2022-01-15,116,bouveret,G132,0,0.0
"('bouveret', '15.01.2022')",Bouveret,Haut lac,1,2022-01-15,116,bouveret,G53,0,0.0
"('bouveret', '15.01.2022')",Bouveret,Haut lac,1,2022-01-15,116,bouveret,G165,0,0.0
"('bouveret', '15.01.2022')",Bouveret,Haut lac,1,2022-01-15,116,bouveret,G137,0,0.0
"('bouveret', '15.01.2022')",Bouveret,Haut lac,1,2022-01-15,116,bouveret,G73,0,0.0
"('bouveret', '15.01.2022')",Bouveret,Haut lac,1,2022-01-15,116,bouveret,G926,0,0.0
"('bouveret', '15.01.2022')",Bouveret,Haut lac,1,2022-01-15,116,bouveret,G126,0,0.0
"('bouveret', '15.01.2022')",Bouveret,Haut lac,1,2022-01-15,116,bouveret,G128,0,0.0
"('bouveret', '15.01.2022')",Bouveret,Haut lac,1,2022-01-15,116,bouveret,G194,0,0.0
"('bouveret', '15.01.2022')",Bouveret,Haut lac,1,2022-01-15,116,bouveret,G48,0,0.0
"('bouveret', '15.01.2022')",Bouveret,Haut lac,1,2022-01-15,116,bouveret,G929,0,0.0
"('bouveret', '15.01.2022')",Bouveret,Haut lac,1,2022-01-15,116,bouveret,G101,0,0.0
"('bouveret', '15.01.2022')",Bouveret,Haut lac,1,2022-01-15,116,bouveret,G133,0,0.0
"('bouveret', '15.01.2022')",Bouveret,Haut lac,1,2022-01-15,116,bouveret,G28,0,0.0
"('bouveret', '15.01.2022')",Bouveret,Haut lac,1,2022-01-15,116,bouveret,G39,0,0.0
"('bouveret', '15.01.2022')",Bouveret,Haut lac,1,2022-01-15,116,bouveret,G4,0,0.0
"('bouveret', '15.01.2022')",Bouveret,Haut lac,1,2022-01-15,116,bouveret,G54,0,0.0
"('bouveret', '15.01.2022')",Bouveret,Haut lac,1,2022-01-15,116,bouveret,G7,0,0.0
"('bouveret', '15.01.2022')",Bouveret,Haut lac,1,2022-01-15,116,bouveret,G155,0,0.0
"('bouveret', '15.01.2022')",Bouveret,Haut lac,1,2022-01-15,116,bouveret,G127,0,0.0
"('bouveret', '15.01.2022')",Bouveret,Haut lac,1,2022-01-15,116,bouveret,G129,0,0.0
"('bouveret', '15.01.2022')",Bouveret,Haut lac,1,2022-01-15,116,bouveret,G136,0,0.0
"('bouveret', '15.01.2022')",Bouveret,Haut lac,1,2022-01-15,116,bouveret,G80,0,0.0
"('bouveret', '15.01.2022')",Bouveret,Haut lac,1,2022-01-15,116,bouveret,G102,0,0.0
"('bouveret', '15.01.2022')",Bouveret,Haut lac,1,2022-01-15,116,bouveret,G139,0,0.0
"('bouveret', '30.04.2022')",Bouveret,Haut lac,1,2022-04-30,116,bouveret,G131,0,0.0
"('bouveret', '30.04.2022')",Bouveret,Haut lac,1,2022-04-30,116,bouveret,G148,0,0.0
"('bouveret', '30.04.2022')",Bouveret,Haut lac,1,2022-04-30,116,bouveret,G211,0,0.0
"('bouveret', '30.04.2022')",Bouveret,Haut lac,1,2022-04-30,116,bouveret,G914,0,0.0
"('bouveret', '30.04.2022')",Bouveret,Haut lac,1,2022-04-30,116,bouveret,G97,0,0.0
"('bouveret', '30.04.2022')",Bouveret,Haut lac,1,2022-04-30,116,bouveret,G159,0,0.0
"('bouveret', '30.04.2022')",Bouveret,Haut lac,1,2022-04-30,116,bouveret,G2,0,0.0
"('bouveret', '30.04.2022')",Bouveret,Haut lac,1,2022-04-30,116,bouveret,G25,0,0.0
"('bouveret', '30.04.2022')",Bouveret,Haut lac,1,2022-04-30,116,bouveret,G125,0,0.0
"('bouveret', '30.04.2022')",Bouveret,Haut lac,1,2022-04-30,116,bouveret,G135,0,0.0
"('bouveret', '30.04.2022')",Bouveret,Haut lac,1,2022-04-30,116,bouveret,G145,0,0.0
"('bouveret', '30.04.2022')",Bouveret,Haut lac,1,2022-04-30,116,bouveret,G29,0,0.0
"('bouveret', '30.04.2022')",Bouveret,Haut lac,1,2022-04-30,116,bouveret,G132,0,0.0
"('bouveret', '30.04.2022')",Bouveret,Haut lac,1,2022-04-30,116,bouveret,G53,0,0.0
"('bouveret', '30.04.2022')",Bouveret,Haut lac,1,2022-04-30,116,bouveret,G165,0,0.0
"('bouveret', '30.04.2022')",Bouveret,Haut lac,1,2022-04-30,116,bouveret,G137,0,0.0
"('bouveret', '30.04.2022')",Bouveret,Haut lac,1,2022-04-30,116,bouveret,G73,0,0.0
"('bouveret', '30.04.2022')",Bouveret,Haut lac,1,2022-04-30,116,bouveret,G926,0,0.0
"('bouveret', '30.04.2022')",Bouveret,Haut lac,1,2022-04-30,116,bouveret,G126,0,0.0
"('bouveret', '30.04.2022')",Bouveret,Haut lac,1,2022-04-30,116,bouveret,G128,0,0.0
"('bouveret', '30.04.2022')",Bouveret,Haut lac,1,2022-04-30,116,bouveret,G194,0,0.0
"('bouveret', '30.04.2022')",Bouveret,Haut lac,1,2022-04-30,116,bouveret,G26,0,0.0
"('bouveret', '30.04.2022')",Bouveret,Haut lac,1,2022-04-30,116,bouveret,G48,0,0.0
"('bouveret', '30.04.2022')",Bouveret,Haut lac,1,2022-04-30,116,bouveret,G901,0,0.0
"('bouveret', '30.04.2022')",Bouveret,Haut lac,1,2022-04-30,116,bouveret,G929,0,0.0
"('bouveret', '30.04.2022')",Bouveret,Haut lac,1,2022-04-30,116,bouveret,G101,0,0.0
"('bouveret', '30.04.2022')",Bouveret,Haut lac,1,2022-04-30,116,bouveret,G12,0,0.0
"('bouveret', '30.04.2022')",Bouveret,Haut lac,1,2022-04-30,116,bouveret,G18,0,0.0
"('bouveret', '30.04.2022')",Bouveret,Haut lac,1,2022-04-30,116,bouveret,G33,0,0.0
"('bouveret', '30.04.2022')",Bouveret,Haut lac,1,2022-04-30,116,bouveret,G67,0,0.0
"('bouveret', '30.04.2022')",Bouveret,Haut lac,1,2022-04-30,116,bouveret,G90,0,0.0
"('bouveret', '30.04.2022')",Bouveret,Haut lac,1,2022-04-30,116,bouveret,G937,0,0.0
"('bouveret', '30.04.2022')",Bouveret,Haut lac,1,2022-04-30,116,bouveret,G39,0,0.0
"('bouveret', '30.04.2022')",Bouveret,Haut lac,1,2022-04-30,116,bouveret,G4,0,0.0
"('bouveret', '30.04.2022')",Bouveret,Haut lac,1,2022-04-30,116,bouveret,G54,0,0.0
"('bouveret', '30.04.2022')",Bouveret,Haut lac,1,2022-04-30,116,bouveret,G7,0,0.0
"('bouveret', '30.04.2022')",Bouveret,Haut lac,1,2022-04-30,116,bouveret,G155,0,0.0
"('bouveret', '30.04.2022')",Bouveret,Haut lac,1,2022-04-30,116,bouveret,G127,0,0.0
"('bouveret', '30.04.2022')",Bouveret,Haut lac,1,2022-04-30,116,bouveret,G129,0,0.0
"('bouveret', '30.04.2022')",Bouveret,Haut lac,1,2022-04-30,116,bouveret,G136,0,0.0
"('bouveret', '30.04.2022')",Bouveret,Haut lac,1,2022-04-30,116,bouveret,G80,0,0.0
"('bouveret', '30.04.2022')",Bouveret,Haut lac,1,2022-04-30,116,bouveret,G102,0,0.0
"('bouveret', '30.04.2022')",Bouveret,Haut lac,1,2022-04-30,116,bouveret,G139,0,0.0
"('clarens', '16.01.2022')",Clarens,Haut lac,2,2022-01-16,52,clarens,G114,0,0.0
"('clarens', '16.01.2022')",Clarens,Haut lac,2,2022-01-16,52,clarens,G131,0,0.0
"('clarens', '16.01.2022')",Clarens,Haut lac,2,2022-01-16,52,clarens,G148,0,0.0
"('clarens', '16.01.2022')",Clarens,Haut lac,2,2022-01-16,52,clarens,G211,0,0.0
"('clarens', '16.01.2022')",Clarens,Haut lac,2,2022-01-16,52,clarens,G24,0,0.0
"('clarens', '16.01.2022')",Clarens,Haut lac,2,2022-01-16,52,clarens,G79,0,0.0
"('clarens', '16.01.2022')",Clarens,Haut lac,2,2022-01-16,52,clarens,G905,0,0.0
"('clarens', '16.01.2022')",Clarens,Haut lac,2,2022-01-16,52,clarens,G914,0,0.0
"('clarens', '16.01.2022')",Clarens,Haut lac,2,2022-01-16,52,clarens,G922,0,0.0
"('clarens', '16.01.2022')",Clarens,Haut lac,2,2022-01-16,52,clarens,G931,0,0.0
"('clarens', '16.01.2022')",Clarens,Haut lac,2,2022-01-16,52,clarens,G932,0,0.0
"('clarens', '16.01.2022')",Clarens,Haut lac,2,2022-01-16,52,clarens,G97,0,0.0
"('clarens', '16.01.2022')",Clarens,Haut lac,2,2022-01-16,52,clarens,G159,0,0.0
"('clarens', '16.01.2022')",Clarens,Haut lac,2,2022-01-16,52,clarens,G10,0,0.0
"('clarens', '16.01.2022')",Clarens,Haut lac,2,2022-01-16,52,clarens,G103,0,0.0
"('clarens', '16.01.2022')",Clarens,Haut lac,2,2022-01-16,52,clarens,G106,0,0.0
"('clarens', '16.01.2022')",Clarens,Haut lac,2,2022-01-16,52,clarens,G117,0,0.0
"('clarens', '16.01.2022')",Clarens,Haut lac,2,2022-01-16,52,clarens,G2,0,0.0
"('clarens', '16.01.2022')",Clarens,Haut lac,2,2022-01-16,52,clarens,G25,0,0.0
"('clarens', '16.01.2022')",Clarens,Haut lac,2,2022-01-16,52,clarens,G125,0,0.0
"('clarens', '16.01.2022')",Clarens,Haut lac,2,2022-01-16,52,clarens,G135,0,0.0
"('clarens', '16.01.2022')",Clarens,Haut lac,2,2022-01-16,52,clarens,G145,0,0.0
"('clarens', '16.01.2022')",Clarens,Haut lac,2,2022-01-16,52,clarens,G29,0,0.0
"('clarens', '16.01.2022')",Clarens,Haut lac,2,2022-01-16,52,clarens,G32,0,0.0
"('clarens', '16.01.2022')",Clarens,Haut lac,2,2022-01-16,52,clarens,G50,0,0.0
"('clarens', '16.01.2022')",Clarens,Haut lac,2,2022-01-16,52,clarens,G99,0,0.0
"('clarens', '16.01.2022')",Clarens,Haut lac,2,2022-01-16,52,clarens,G132,0,0.0
"('clarens', '16.01.2022')",Clarens,Haut lac,2,2022-01-16,52,clarens,G53,0,0.0
"('clarens', '16.01.2022')",Clarens,Haut lac,2,2022-01-16,52,clarens,G165,0,0.0
"('clarens', '16.01.2022')",Clarens,Haut lac,2,2022-01-16,52,clarens,G137,0,0.0
"('clarens', '16.01.2022')",Clarens,Haut lac,2,2022-01-16,52,clarens,G926,0,0.0
"('clarens', '16.01.2022')",Clarens,Haut lac,2,2022-01-16,52,clarens,G126,0,0.0
"('clarens', '16.01.2022')",Clarens,Haut lac,2,2022-01-16,52,clarens,G128,0,0.0
"('clarens', '16.01.2022')",Clarens,Haut lac,2,2022-01-16,52,clarens,G26,0,0.0
"('clarens', '16.01.2022')",Clarens,Haut lac,2,2022-01-16,52,clarens,G48,0,0.0
"('clarens', '16.01.2022')",Clarens,Haut lac,2,2022-01-16,52,clarens,G901,0,0.0
"('clarens', '16.01.2022')",Clarens,Haut lac,2,2022-01-16,52,clarens,G929,0,0.0
"('clarens', '16.01.2022')",Clarens,Haut lac,2,2022-01-16,52,clarens,G101,0,0.0
"('clarens', '16.01.2022')",Clarens,Haut lac,2,2022-01-16,52,clarens,G34,0,0.0
"('clarens', '16.01.2022')",Clarens,Haut lac,2,2022-01-16,52,clarens,G100,0,0.0
"('clarens', '16.01.2022')",Clarens,Haut lac,2,2022-01-16,52,clarens,G12,0,0.0
"('clarens', '16.01.2022')",Clarens,Haut lac,2,2022-01-16,52,clarens,G144,0,0.0
"('clarens', '16.01.2022')",Clarens,Haut lac,2,2022-01-16,52,clarens,G18,0,0.0
"('clarens', '16.01.2022')",Clarens,Haut lac,2,2022-01-16,52,clarens,G33,0,0.0
"('clarens', '16.01.2022')",Clarens,Haut lac,2,2022-01-16,52,clarens,G67,0,0.0
"('clarens', '16.01.2022')",Clarens,Haut lac,2,2022-01-16,52,clarens,G90,0,0.0
"('clarens', '16.01.2022')",Clarens,Haut lac,2,2022-01-16,52,clarens,G937,0,0.0
"('clarens', '16.01.2022')",Clarens,Haut lac,2,2022-01-16,52,clarens,G133,0,0.0
"('clarens', '16.01.2022')",Clarens,Haut lac,2,2022-01-16,52,clarens,G28,0,0.0
"('clarens', '16.01.2022')",Clarens,Haut lac,2,2022-01-16,52,clarens,G39,0,0.0
"('clarens', '16.01.2022')",Clarens,Haut lac,2,2022-01-16,52,clarens,G4,0,0.0
"('clarens', '16.01.2022')",Clarens,Haut lac,2,2022-01-16,52,clarens,G54,0,0.0
"('clarens', '16.01.2022')",Clarens,Haut lac,2,2022-01-16,52,clarens,G7,0,0.0
"('clarens', '16.01.2022')",Clarens,Haut lac,2,2022-01-16,52,clarens,G155,0,0.0
"('clarens', '16.01.2022')",Clarens,Haut lac,2,2022-01-16,52,clarens,G127,0,0.0
"('clarens', '16.01.2022')",Clarens,Haut lac,2,2022-01-16,52,clarens,G129,0,0.0
"('clarens', '16.01.2022')",Clarens,Haut lac,2,2022-01-16,52,clarens,G136,0,0.0
"('clarens', '16.01.2022')",Clarens,Haut lac,2,2022-01-16,52,clarens,G80,0,0.0
"('clarens', '16.01.2022')",Clarens,Haut lac,2,2022-01-16,52,clarens,G102,0,0.0
"('clarens', '16.01.2022')",Clarens,Haut lac,2,2022-01-16,52,clarens,G139,0,0.0
"('clarens', '17.12.2022')",Clarens,Haut lac,2,2022-12-17,52,clarens,G114,0,0.0
"('clarens', '17.12.2022')",Clarens,Haut lac,2,2022-12-17,52,clarens,G131,0,0.0
"('clarens', '17.12.2022')",Clarens,Haut lac,2,2022-12-17,52,clarens,G148,0,0.0
"('clarens', '17.12.2022')",Clarens,Haut lac,2,2022-12-17,52,clarens,G21,0,0.0
"('clarens', '17.12.2022')",Clarens,Haut lac,2,2022-12-17,52,clarens,G211,0,0.0
"('clarens', '17.12.2022')",Clarens,Haut lac,2,2022-12-17,52,clarens,G23,0,0.0
"('clarens', '17.12.2022')",Clarens,Haut lac,2,2022-12-17,52,clarens,G31,0,0.0
"('clarens', '17.12.2022')",Clarens,Haut lac,2,2022-12-17,52,clarens,G66,0,0.0
"('clarens', '17.12.2022')",Clarens,Haut lac,2,2022-12-17,52,clarens,G914,0,0.0
"('clarens', '17.12.2022')",Clarens,Haut lac,2,2022-12-17,52,clarens,G922,0,0.0
"('clarens', '17.12.2022')",Clarens,Haut lac,2,2022-12-17,52,clarens,G931,0,0.0
"('clarens', '17.12.2022')",Clarens,Haut lac,2,2022-12-17,52,clarens,G97,0,0.0
"('clarens', '17.12.2022')",Clarens,Haut lac,2,2022-12-17,52,clarens,G10,0,0.0
"('clarens', '17.12.2022')",Clarens,Haut lac,2,2022-12-17,52,clarens,G103,0,0.0
"('clarens', '17.12.2022')",Clarens,Haut lac,2,2022-12-17,52,clarens,G117,0,0.0
"('clarens', '17.12.2022')",Clarens,Haut lac,2,2022-12-17,52,clarens,G2,0,0.0
"('clarens', '17.12.2022')",Clarens,Haut lac,2,2022-12-17,52,clarens,G25,0,0.0
"('clarens', '17.12.2022')",Clarens,Haut lac,2,2022-12-17,52,clarens,G125,0,0.0
"('clarens', '17.12.2022')",Clarens,Haut lac,2,2022-12-17,52,clarens,G135,0,0.0
"('clarens', '17.12.2022')",Clarens,Haut lac,2,2022-12-17,52,clarens,G145,0,0.0
"('clarens', '17.12.2022')",Clarens,Haut lac,2,2022-12-17,52,clarens,G29,0,0.0
"('clarens', '17.12.2022')",Clarens,Haut lac,2,2022-12-17,52,clarens,G32,0,0.0
"('clarens', '17.12.2022')",Clarens,Haut lac,2,2022-12-17,52,clarens,G50,0,0.0
"('clarens', '17.12.2022')",Clarens,Haut lac,2,2022-12-17,52,clarens,G99,0,0.0
"('clarens', '17.12.2022')",Clarens,Haut lac,2,2022-12-17,52,clarens,G132,0,0.0
